id,name,price,rating,feedbacks,brand,power_type,zones,description
291888914,Спортивный массажер миостимулятор для тела электрический,2607.0,4.7,2160,TARGO,от аккумулятора; от сети,живот; ягодицы; бедра,"Спортивный массажер мио стимулятор - многофункциональный персональный Фитнес тренер для всего тела у вас дома. Это Красота и Здоровье в одном миниатюрном приборе:- подтяжка тела- набор мышечной массы- снижение весаЭлектрическая мионейростимуляция - оздоровительная процедура с воздействием низкочастотных микротоков на мышечную ткань.В основе работы EMS и TENS стимуляция нервных окончаний путем передачи импульсного тока через электроды для расслабления, восстановления или стимуляции мышц. Организм воспринимает импульсы как естественные, мускулатура сокращается без совершения реальной работы. Аппликаторы сокращают мышцы, обогащая кровь кислородом. Происходит отток лимфы и улучшение мышечного тонуса.Прибор безболезненно и эффективно действует на спину, поясницу, ноги, шею, колени, бедра, пресс и живот.Снимает боли и спазмы в обасти плеч, восстанавливает после инсультов, травм и операций. Борется с варикозом, убирает целлюлит и жировые отложения на ягодицах при похудении. Портативный мини электро гаджет предназначен для массажа, антицеллюлитной коррекции фигуры и сжигания жира. Функции массирование, растирание и аккурунктура идеально подходят женщинам и мужчинам.Уникальные ЛОР насадки помогают малышам и взрослым в лечении и профилактике респираторных заболеваний. Универсальный инновационный мультифункциональный аппарат удобен в домашних условиях. Лечебные программы электромиостимуляции, электронейростимуляции и лимфодренажа.Микротоковый электрофорез снимает стресс, усталость и эмоциональную нагрузку. Миомассажер избавит от остео хондроза, тяжести в тканях при повышеных физических нагрузках, тренировках и малоподвижном образе жизни. Устраняет застойные явления, повышает выносливость, улучшает сон и восполняет жизненные силы. Регулировка интенсивности заменит девайсы для спорта. Тренажер от остеохондроза подарок родителям на юбилей 60 лет. Маме, папе, бабушке, дедушке, теще. Дарите шейный электромассажер в день рождения брату, любимому мужу, подруге и сестре"
143533250,"Массажер миостимулятор для тела, спины, шеи и поясницы",2677.0,4.7,2160,TARGO,от аккумулятора; от сети,спина; тело; ноги,"Массажер мио стимулятор - многофункциональный персональный помощник для Здоровья и экспресс Восстановления всего тела в одном миниатюрном приборе у вас дома.Эффективно и безболезненно действует на зоны:- спина- поясница- ноги- шея- колени- бедра- пресс и живот. Электрическая мионейростимуляция – это оздоровительная процедура с воздействием низкочастотных микротоков на мышечную ткань.В основе работы EMS и TENS стимуляция нервных окончаний путем передачи импульсного тока через электроды для расслабления, восстановления или стимуляции мышц. Организм воспринимает импульсы как естественные и мускулатура сокращается без совершения реальной работы. Аппликаторы сокращают мышцы, обогащая кровь кислородом. Происходит отток лимфы и улучшение мышечного тонуса.Прибор мгновенно снимает боли и спазмы в обасти плеч, восстанавливает после инсультов, травм и операций. Борется с варикозом, убирает целлюлит и жировые отложения на ягодицах при похудении. Портативный мини электро гаджет предназначен для массажа, антицеллюлитной коррекции веса фигуры и сжигания жира.Функции массирование, растирание и аккурунктура подходят женщинам и мужчинам.Уникальные ЛОР насадки помогают малышам и взрослым в лечении и профилактике респираторных заболеваний. Универсальный инновационный мультифункциональный аппарат удобен в домашних условиях. Лечебные программы электромиостимуляции, электронейростимуляции и лимфодренажа.Микротоковый электрофорез снимает стресс, усталость и эмоциональную нагрузку. Миомассажер избавит от остео хондроза, тяжести в тканях при повышенных физических нагрузках, спортивных тренировках и малоподвижном образе жизни. Устраняет застойные явления, повышает выносливость, улучшает сон и восполняет жизненные силы. Регулировка уровней интенсивности заменит девайсы для спорта. Тренажер от остеохондроза подарок родителям на юбилей 60 лет. Маме, папе, бабушке, дедушке, теще. Дарите шейный электромассажер в день рождения брату, любимому мужу, подруге и сестре"
174098651,Массажер мио стимулятор для шеи,5400.0,4.3,10,,встроенный аккумулятор,шея,"Мио стимулятор для шеи - ощущение комфорта и расслабления на грани нового уровня!Приветствую! Если ты ищешь идеальное средство для максимального расслабления и ухода за своим телом, то Массажер мио стимулятор для шеи - твой идеальный выбор! Позволь мне рассказать тебе, почему этот микротоковый миостимулятор стоит твоего внимания.Помимо уникального дизайна и компактных размеров, этот электрический миостимулятор специально разработан для эффективного массажа мышц шеи, спины и воротниковой зоны. Он использует микротоки, чтобы активировать мышцы, способствуя глубокому расслаблению и оздоровлению всего тела.Вот почему Массажер электростимулятор для шеи - это революционный аппарат для миостимуляции и электрического массажа:- Миостимуляция: Уникальная технология микротоков позволит тебе нежно стимулировать мышцы, обеспечивая непревзойденное чувство расслабления и снятия напряжения.- Легкий и компактный: Благодаря своему мини размеру, этот массажер станет твоим незаменимым спутником в путешествиях и повседневной жизни. Наслаждайся массажем в любое время и в любом месте!- Беспроводной: Этот электромиостимулятор оснащен батареей, поэтому нет необходимости использовать провода. Готов к использованию в любой момент!- Многофункциональный: Не только для шеи! Этот электромассажер также отлично подходит для использования на других зонах тела, таких как воротниковая зона, часть мышц спины. Обнаружь новые возможности для ухода за собой!- Оздоровление и косметический эффект: Благодаря электростимуляции мио стимулятор поможет усилить массажный эффект и улучшить общее состояние кожи. Получи не только расслабление, но и красоту!Если ты ищешь идеальный подарок для себя или для близкого человека, то Массажер Мио стимулятор для шеи - это идеальный выбор. Не упусти возможность насладиться максимальным расслаблением и оздоровительным эффектом, просто нажми на кнопку ""Добавить в корзину"" прямо сейчас!"
44081627,Миостимулятор для пресса тренажер ABS Trainer MIO,5012.0,4.7,1499,Yamaguchi,5 В; от аккумулятора; без питания,пресс; живот; тело,"Миостимулятор для тела Yamaguchi ABS Trainer MIO - портативное устройство нового поколения с технологией миостимуляции (EMS), разработанное для тренировки мышц пресса у мужчин и женщин. 

EMS тренировка — это новая ступень в развитии фитнеса. Уникальная технология миостимуляции мышц в комплексе с физическими упражнениями дает незамедлительный результат. Эффективность таких упражнений в 5-10 раз превышает обычные занятия фитнесом. В результате таких тренировок все мышцы начинают сокращаться, кровоток увеличивается, жировые и белковые отложения начинают отдаляться от подвижных мышц. Общее ощущение от такого воздействия на тело - легкость в управлении телом как после фитнес-тренировки.

Миостимулятор для пресса позволяет создать красивый рельефный пресс с минимальными затратами времени и усилий. Тренажер для пресса оказывает комплексное воздействие на организм и активизирует важные биологические процессы, которые способствуют улучшению внешнего вида. Вибромассажер для пресса укрепляет и восстанавливает мышцы, корректирует фигуру. Тренажер для снижения веса дает лимфодренажный эффект, снимает мышечную боль. Применение миостимулятора для похудения живота улучшает эластичность и тонус кожного покрова. Инновационная технология миостимуляции многократно повышает эффективность упражнений. Во время тренировки с применением электротренажера для пресса активизируется кровоток, происходит сокращение всех мышц. 

Компактный беспроводной дизайн стимулятора для пресса позволяет брать его с собой и устраивать тренировку в любом удобном месте. Миостимулятор электрический Ямогучи помещается даже в самую маленькую сумочку

Массажер для похудения живота Ямагучи имеет 2 автоматические программы и 15 уровней интенсивности воздействия, которые делают занятия максимально комфортными и эффективными

Частота использования пластины с электродами 30-50 раз

Жиросжигающий массажер – незаменимая вещь для поддержания себя в форме, улучшения внешнего вида, создания красивого рельефного пресса."
236798629,Миостимулятор массажер для терапии,632.0,4.8,30,Другой мир,от сети; USB,плечи; спина; тело,"Массажер электрический для лица и тела. Миостимулятор используется для стимуляции мышц с помощью электро импульсов. Медицинский прибор для домашнего применения можно использовать в различных целях. Мио стимулятор поможет решить вопросы в области красоты и здоровья. Подходит для женщин, мужчин и детей любого возраста. Показывает отличный оздоровительный эффект людям, перенесшим инсульт, паралич и с мышечной дистрофией. Улучшает подвижность и функции с этими заболеваниями. Чудо-массажер прекрасно корректирует фигуру. Благодаря ему можно похудеть, убрать лишний вес и отёки. Подтягивает ягодицы и пропадает целлюлит. Пресс на животе станет более рельефным. Стимуляция способствует улучшению кровообращения и укрепление мышц. Благодаря массажёру кожа становиться упругой натянутой и уходят мелкие морщины. Косметический аппарат предотвратить появление растяжек и глубокие морщины будут менее заметные. Обращаем ваше внимание на терапевтическое действие. Боли в спине, варикоз, отёчность ног улучшается происходят после нескольких применений. Наш мини доктор ничем не уступает технике в клиниках и дорогих салонах. Массажные аксессуары необходимо иметь в каждом доме. Массаж – любимая многими процедура, позволяющая снять напряжение. Лучший массажер антицеллюлитный для тела."
176410178,Массажер мио стимулятор для шеи,4607.0,4.6,33,COMTEK,,шея; воротниковая зона,"Мио стимулятор для шеи - ощущение комфорта и расслабления на грани нового уровня!Приветствую! Если ты ищешь идеальное средство для максимального расслабления и ухода за своим телом, то Массажер мио стимулятор для шеи - твой идеальный выбор! Позволь мне рассказать тебе, почему этот микротоковый миостимулятор стоит твоего внимания.Помимо уникального дизайна и компактных размеров, этот электрический миостимулятор специально разработан для эффективного массажа мышц шеи, спины и воротниковой зоны. Он использует микротоки, чтобы активировать мышцы, способствуя глубокому расслаблению и оздоровлению всего тела.Вот почему Массажер электростимулятор для шеи - это революционный аппарат для миостимуляции и электрического массажа:- Миостимуляция: Уникальная технология микротоков позволит тебе нежно стимулировать мышцы, обеспечивая непревзойденное чувство расслабления и снятия напряжения.- Легкий и компактный: Благодаря своему мини размеру, этот массажер станет твоим незаменимым спутником в путешествиях и повседневной жизни. Наслаждайся массажем в любое время и в любом месте!- Беспроводной: Этот электромиостимулятор оснащен батареей, поэтому нет необходимости использовать провода. Готов к использованию в любой момент!- Многофункциональный: Не только для шеи! Этот электромассажер также отлично подходит для использования на других зонах тела, таких как воротниковая зона, часть мышц спины. Обнаружь новые возможности для ухода за собой!- Оздоровление и косметический эффект: Благодаря электростимуляции мио стимулятор поможет усилить массажный эффект и улучшить общее состояние кожи. Получи не только расслабление, но и красоту!Если ты ищешь идеальный подарок для себя или для близкого человека, то Массажер Мио стимулятор для шеи - это идеальный выбор. Не упусти возможность насладиться максимальным расслаблением и оздоровительным эффектом, просто нажми на кнопку ""Добавить в корзину"" прямо сейчас!"
258261491,Многофункциональный мини массажер для тела бабочка,346.0,4.7,3,БРК БРЕНД,аккумулятор USB; ems,"спина шея поясница руки ноги; пояс живот шейный; бабочка на голень, под колено,ягодицы пресс","Универсальный микротоковый EMS массажер бабочка с подогревом – инновационны физиотерапевтический аппарат для людей с малоподвижным образом жизни. Эффективен при остеохондрозе и повреждении нервных окончаний. Наш электромассажер для пресса живота изготовлен из инновационного материала. Массажный тренажер имеет 6 уникальных техник и 19 вариантов интенсивности, что позволяет использовать микротоки разной частоты и степени воздействия, эффективно прорабатывая поврежденный участок тела, который заботится о вашей коже и не вызывает раздражения. Мини гаджет рекомендуется для людей страдающих синдромом усталой спины. Проработка всех отделов позвоночника от шейного воротника а так коррекция фигуры и уменьшение живота. Наш массажер для живота и укрепления мышц, в том числе пресса - это готовое решение для всех, кто хочет добиться результатов и изменить свое тело. Он помогает убирать лишние сантиметры на талии и обеспечивать похудение живота. Помогает получить рельеф мышц тела и пресса. Он компактный и легкий, поэтому вы можете брать его с собой куда угодно, чтобы держать тело в форме. Воздействуя на меридианы и акупунктурные точки короткими импульсами тока электрический миостимулятор мио стимулятор так же убирает зажимы и защемления. Функция теплового компресса, подогрев до 43С позволяет воздействовать на более глубинные слои. Он поможет убрать живот, работает как поддержка и восстановление мышц после тренировок и станет отличным подарком для друзей и близких. массажер для спины электрический. электрический стимулятор. виброплатформа. массажная подушка. массажеры электрические. миостимулятор. тренажер для спины . тренажер для шни. лимфодренажный массажер для тела электрический . массажер для антицеллюлитный . массажер для спины электрический . массажер электрический. 
Предотвращает застой крови и лимфи, ведет к уменьшению отечности и борется с целлюлитом. Хороший подарок на праздник любимой или любимому маме папе бабушке дедушке."
