id,name,price,rating,feedbacks,brand,power_type,zones,description
82587770,Массажный мио стимулятор коврик для стоп,368.0,3.3,204,Массажер для стоп,,ноги; стопы; лодыжки,"Акупунктурный массажер миостимулятор для ног отличная замена традиционному китайскому иглоукалыванию. Это профессиональное оборудование, которое охватит ваш организм целиком. Уже давно доказано, что на наших стопах есть точки, которые отвечают за разные участки тела. Их активная проработка приводит к улучшению самочувствия и максимальной гармонии для вашего организма. Устройство воздействует на ноги посредством коротких электрических импульсов и помогает избавиться от боли в мышцах и суставах. В комплект входит пульт для удобного управления всеми функциями миостимулятора и USB кабель для зарядки. Материал верха - контактный, приятный на ощупь. Благодаря компактным габаритам, массажер всегда можно взять с собой и воспользоваться им в любом месте и в любое время. Электромассаж ног — эффективная методика лечения и профилактики болезней, связанных с дисфункцией или усталостью ног. Рабочие характеристики массажера позволяют ему за короткое время восстановить естественный цикл кровообращения. В устройстве запрограммировано несколько видов электрических импульсов, которые отличаются амплитудой и частотой импульса. Точечные, мгновенные импульсы заставляют сокращаться мышцы посредством воздействия на нервные окончания. Они устраняют болевой синдром и снимают ощущения тяжести. Усиление кровообращения благотворно сказывается на организме. Девайс выглядит как обычный коврик. Габариты подходят для размещения двух стоп. Компактное устройство легко складывается и убирается в сумку или на полку. Оно предлагается в элегантной упаковке, поэтому может послужить оригинальным подарком для близкого человека. Массаж стоп является безвредным и эффективным методом лечения и профилактики заболеваний, положительно влияющий на весь организм в целом. Миостимулятор обладает множеством полезных лечебных, тонизирующих и расслабляющих свойств:- стимулирует рефлекторные зоны стопы, облегчая болевые ощущения;- восстанавливает подвижность суставов ног при артритах и артрозах;- воздействует на биологически активные точки;- положительно влияет на нервную, опорно-двигательную и иммунную системы организма;- устраняет застойные явления в кровеносных сосудах нижних конечностей;- восстанавливает функции стоп;- предотвращает развитие плоскостопия у детей;- нормализует сон и давление;- способствует укреплению мышц свода стопы;- снимает мышечное напряжение, отеки, усталость в ногах;- оказывает седативное и антидепрессивное действие;- предотвращает появление мозолей и натоптышей, огрубение кожи и т.д. Противопоказания:- Беременность.- Наличие порока сердца, нарушения сердечного ритма.- Наличие кардиостимулятора или имплантируемого дефибриллятора.- Острые инфекционные заболевания.- Наличие острого или хронического выраженного тромбоза глубоких вен (тромбоз в анамнезе или оперативно реканализированный не противопоказание!).- Наличие металлических имплантов (кроме титановых эндопротезов) в ногах.- Открытая рана стоп.- Нарушения кожного покрова / кожные патологии в период обострения.Если не уверены подходит ли вам данный массажер, то рекомендуем проконсультироваться с лечащим врачом или врачом-физиотерапевтом.Резина обладает защитой от неприятного запаха, не впитывает его. Массажер имеет 6 режимов работы и 19 уровней интенсивности воздействия. Вы сможете выбрать режим, который будет для вас комфортным и поможет быстрее достичь поставленных целей. Электрический бытовой прибор универсальный. Техника будет особенно полезна водителям и спортсменам. С помощью этого плоского компактного девайса вы сможете избавиться от отеков после сидячей офисной работы. Черный коврик для ухода за ногами будет способствовать снятию мышечного напряжения после спортивных тренировок в зале, окажет расслабляющее действие и избавит от судорог икроножных мышц. Ваши ноги получат долгожданный отдых, а вы испытаете настоящее блаженство и избавитесь от тревоги в процессе расслабляющего массажа. Также миниатюрная массажка поможет вам в борьбе с остеохондрозом. Гаджет также имеет лимфодренажный эффект, который помогает очистить организм от токсинов и улучшить кровообращение. А еще микротоки и импульсы помогают укрепить мышцы ног и улучшить состояние кожи. Резиновый аксессуар обеспечить вам точечный массаж. На ступнях, пальцах и пятках расположены акупунктурные триггерные точки, их миостимуляция очень полезна. Оно поспособствует общему оздоровлению организма, а также поможет в похудении и коррекции фигуры. Чтобы получить максимальный эффект, лучше всего сочетать акупунктурный массаж с фитнесом или занятиями на тренажерах. Также воздействие на особые точки с помощью мощных микротоков будет иметь косметический эффект, поможет омоложению. Коврик могут использовать как взрослые мужчины и женщины, так и подростки. Подарите физиотерапевтический аппарат родителям (маме и папе), девушке, парню и другим близким вам людям на День рождения, юбилей, годовщину, новоселье или другой праздник."
219210862,Электрический массажёр для шеи,1220.0,4.7,3,Sunday Fun,от сети; от аккумулятора; USB,голова; плечи; массажер для шеи и спины,"Дорогие клиенты! Мы хотим сказать огромное спасибо за вашу веру в нас! В благодарность за вашу лояльность, мы запускаем уникальную акцию, которая призвана сделать ваш шоппинг более увлекательным. Сделайте покупку любого товара из нашего магазина, и вы автоматически станете участником розыгрыша нашего главного приза - потрясающего телевизора! Подробности и флаер на розыгрыш в каждом товаре !

Беспроводной массажёр - это инновационное решение для ухода и расслабления всего вашего тела. Этот компактный и эффективный массажер предназначен для использования на различных частях тела, обеспечивая приятные и полезные процедуры в любое время.

Благодаря удобному и компактному дизайну, вы можете легко использовать его в домашних условиях или даже в дороге. Он предлагает широкий спектр функций, от массажа лица до облегчения напряжения в плечах и спине. Этот беспроводной массажер способен работать длительное время, что позволяет наслаждаться процедурой без лишних перерывов.

С помощью этого массажера вы можете провести массаж лица от морщин и отеков, мягко улучшая состояние кожи и стимулируя кровообращение. Мио-стимулятор для лица позволяет достичь удивительных результатов в уходе за кожей, делая ее более упругой и молодой.

Электрический массажер для тела с различными насадками предоставляет возможность проводить массаж всех групп мышц, от шеи и спины до ног и рук. Бытовая техника этого уровня качества обеспечивает вам возможность полноценной процедуры массажа в комфорте вашего дома.

Отдайте предпочтение удобству и результативности с беспроводным массажёром для всего тела. Погрузитесь в мир релаксации и заботы о себе с помощью этого электрического устройства, которое станет вашим надежным помощником в улучшении самочувствия и эстетического состояния вашей кожи. Наслаждайтесь приятными моментами массажа и ухода прямо у себя дома с помощью этого превосходного массажёра."
103494005,Спортивный миостимулятор Для пресса,677.0,3.0,2,Спортивный миостимулятор / тренажер для тела,,Спина / Шея / Руки /; живот,"Smart Fitnes массажер. Эффективный тренажер миостимулятор EMS Trainer. Помогает приводить ваше тело в идеальную фигуру, не посещая фитнес-зал, или усилить эффект от тренировок в тренаже, дабы достичь максимальных результатов! Со стимулятором мышц - это намного легче, чем вы могли себе представить. EMS - Trainer - стимулятор мышц, изготовлен из качественных материалов. Он эффективен и безопасен. Тело вашей мечты - поможет создать мио Стимулятор мышц. Только закрепите его у себя на теле и миотренажер будет работать без вашей помощи! Красивый дизайн. Легкок в управлении, переносной и компактный миостимулятор можно всегда взять с собой. Делая тренировки с ЕМС-тренер раз в день - вы достигните желаемого результата! Это электрический массажер, массажер для ног электрический, массажер электрический подушка, массажер ямагучи, электрический массажер для тела, массажер антицеллюлитный электрический, вакуумный массажер электрический и инфракрасный массажер. Закажите миостимулятор прямо сейчас!"
153427024,Стимулятор корнеобразования Power Roots 100мл,5530.0,0.0,0,Plagron,,,"Power Roots - это органический стимулятор роста корневой системы. Применяется во время фазы роста и в первые недели цветения. Помимо стимулирования корнеобразования препарат повышает общую сопротивляемость растения к болезням. Этот экономный препарат работает быстро и всасывается растением практически моментально, растения вырастут сильными и будут иметь крепкую корневую систему.
Стимулирует рост корневой системы, повышает устойчивость к болезням и паразитам, помогает растению восстановиться после пересадки или высадки в открытый грунт, подходит для всех систем полива.

Особенности:
Быстрое и плодотворное развитие корневой системы.
Быстрое восстановление после пересадки.
Повышает жизненный тонус.
Улучшает усвоение удобрений.
Улучшает структуру земли.

Технические характеристики:
Тщательно взболтайте перед использованием
Добавляйте 1мл состава на 1л воды
Используйте при каждом поливе до четвертой недели стадии цветения
В составе вода, гуминовые кислоты, экстракт водорослей, аскорбиновая кислота, аминокислоты, тиамин, альфа-токоферол, мио-инозитол, органическое удобрение на основе азота и калия (1-2)
Растворенный в воде состав храните не более 24 часов, поскольку в составе довольно много органических ингредиентов."
377410491,Электроды липучки 4 шт для миостимулятора,1506.0,0.0,0,ElectrimassagerCorp,,,"Внимание! Это расходники (без аппарата). Электроды липучки 4 шт для миостимулятора. Это расходник для - Миостимулятор это процедурный аппарат с воздействием низкочастотных микро импульсов на мышечную ткань для красоты и здоровья. Посылаемые от устройства электрические импульсы похожи на работу нервной системы, которые заставляют мышцы сокращаться. Микротоковый массажер для лица и тела. При использовании для шеи и спины исчезают боли в зоне позвоночника и головы. Лимфодренажный и антицеллюлитный для ног и ягодиц от целлюлита. Мио стимулятор для пресса и похудения живота."
230736806,Массажёр с комбинированным воздействием,1228.0,0.0,0,FancyPoint,от аккумулятора; от сети; USB,шея; спина; плечи,"Дорогие клиенты! Мы хотим сказать огромное спасибо за вашу веру в нас! В благодарность за вашу лояльность, мы запускаем уникальную акцию, которая призвана сделать ваш шоппинг более увлекательным. Сделайте покупку любого товара из нашего магазина, и вы автоматически станете участником розыгрыша нашего главного приза - потрясающего телевизора! Подробности и флаер на розыгрыш в каждом товаре !

Беспроводной массажёр - это инновационное решение для ухода и расслабления всего вашего тела. Этот компактный и эффективный массажер предназначен для использования на различных частях тела, обеспечивая приятные и полезные процедуры в любое время.

Благодаря удобному и компактному дизайну, вы можете легко использовать его в домашних условиях или даже в дороге. Он предлагает широкий спектр функций, от массажа лица до облегчения напряжения в плечах и спине. Этот беспроводной массажер способен работать длительное время, что позволяет наслаждаться процедурой без лишних перерывов.

С помощью этого массажера вы можете провести массаж лица от морщин и отеков, мягко улучшая состояние кожи и стимулируя кровообращение. Мио-стимулятор для лица позволяет достичь удивительных результатов в уходе за кожей, делая ее более упругой и молодой.

Электрический массажер для тела с различными насадками предоставляет возможность проводить массаж всех групп мышц, от шеи и спины до ног и рук. Бытовая техника этого уровня качества обеспечивает вам возможность полноценной процедуры массажа в комфорте вашего дома.

Отдайте предпочтение удобству и результативности с беспроводным массажёром для всего тела. Погрузитесь в мир релаксации и заботы о себе с помощью этого электрического устройства, которое станет вашим надежным помощником в улучшении самочувствия и эстетического состояния вашей кожи. Наслаждайтесь приятными моментами массажа и ухода прямо у себя дома с помощью этого превосходного массажёра."
230736835,Электрический массажёр для шеи,1236.0,0.0,0,FancyPoint,от сети; от аккумулятора; USB,голова; плечи; массажер для шеи и спины,"Дорогие клиенты! Мы хотим сказать огромное спасибо за вашу веру в нас! В благодарность за вашу лояльность, мы запускаем уникальную акцию, которая призвана сделать ваш шоппинг более увлекательным. Сделайте покупку любого товара из нашего магазина, и вы автоматически станете участником розыгрыша нашего главного приза - потрясающего телевизора! Подробности и флаер на розыгрыш в каждом товаре !

Беспроводной массажёр - это инновационное решение для ухода и расслабления всего вашего тела. Этот компактный и эффективный массажер предназначен для использования на различных частях тела, обеспечивая приятные и полезные процедуры в любое время.

Благодаря удобному и компактному дизайну, вы можете легко использовать его в домашних условиях или даже в дороге. Он предлагает широкий спектр функций, от массажа лица до облегчения напряжения в плечах и спине. Этот беспроводной массажер способен работать длительное время, что позволяет наслаждаться процедурой без лишних перерывов.

С помощью этого массажера вы можете провести массаж лица от морщин и отеков, мягко улучшая состояние кожи и стимулируя кровообращение. Мио-стимулятор для лица позволяет достичь удивительных результатов в уходе за кожей, делая ее более упругой и молодой.

Электрический массажер для тела с различными насадками предоставляет возможность проводить массаж всех групп мышц, от шеи и спины до ног и рук. Бытовая техника этого уровня качества обеспечивает вам возможность полноценной процедуры массажа в комфорте вашего дома.

Отдайте предпочтение удобству и результативности с беспроводным массажёром для всего тела. Погрузитесь в мир релаксации и заботы о себе с помощью этого электрического устройства, которое станет вашим надежным помощником в улучшении самочувствия и эстетического состояния вашей кожи. Наслаждайтесь приятными моментами массажа и ухода прямо у себя дома с помощью этого превосходного массажёра."
