id,name,price,rating,feedbacks,brand
261413896,Импульсный массажёр с регулированием температуры,1224.0,0.0,0,Five Stars
311960873,Массажер для ног электрический,6417.0,0.0,0,
311830369,Массажер для тела,6869.0,0.0,0,
158127761,Электронный фитнес-пояс Пояс массажер для похудения,680.0,4.2,17,GOODSTORAGE
257906305,Массажёр с функцией тепловой терапии,1205.0,0.0,0,Amber heart
262518189,Пояс-миостимулятор для похудения,932.0,0.0,0,GOODSGOGO
311968558,Массажер для тела,6804.0,0.0,0,
337805606,перкуссионный массажер,6219.0,0.0,0,
257908486,Массажёр для шеи с эргономичным дизайном,1258.0,0.0,0,AND
257892939,Микротоковый-роликовый массажер для лица и шеи,1205.0,0.0,0,Angie by Angel
369513946,Микротоковый аппарат профессиональный для лица,7249.0,5.0,3,ReginaG
219208657,Автономный массажёр с регулируемыми режимами массажа,1257.0,0.0,0,SUNDAY FUN
311935086,Перкуссионный массажер,5960.0,0.0,0,
420692777,Массажер тренажер для ягодиц,1692.0,0.0,0,
420692776,Массажер тренажер для ягодиц,1552.0,0.0,0,
375587245,Микротоковый массажер для лица и шеи от морщин и отеков,1051.0,4.7,60,SaleHome
311937899,Массажер для головы,6284.0,0.0,0,
311838430,Массажер для похудения - живота,6194.0,0.0,0,
261412300,Импульсный массажёр для шеи для глубокого расслабления,1234.0,0.0,0,Five Stars
411814051,Пояс для похудения живота бедер Массажер,535.0,0.0,0,
313624850,Эффективный массажёр для ног для расслабления,798.0,0.0,0,
377410701,Массажер портативный для шеи,2907.0,0.0,0,ElectrimassagerCorp
399187228,"Микротоковый массажер для лица и шеи, аппарат 6в1",4272.0,0.0,0,HappyMo
415863429,Массажер для тела электрический микротоковый с подогревом,1610.0,0.0,0,ElectricOnline
261412533,Массажёр с индивидуализированными программами терапии,1239.0,0.0,0,
257909456,Многофункциональный массажёр для шеи,1245.0,0.0,0,Amber heart
321527395,Массажер для лица электрический RF лифтинг микротоковый,1379.0,4.8,74,ChillS
253733544,Массажер для шеи и спины,1352.0,4.3,32,Homemade
257910065,Персонализированный массажёр с терапевтическим нагревом,1239.0,0.0,0,Amber heart
409882196,Массажер тренажер для ягодиц,1490.0,0.0,0,
258442517,"Массажер для шеи, спины и тела электрический",1195.0,4.1,11,ComfuCo
211361643,Электрический косметический массажер для шеи спины и тела,1928.0,4.4,5,SportBoom
257908821,Импульсный беспроводной массажёр для шеи,1220.0,0.0,0,Amber heart
371620123,Пояс-миостимулятор для похудения,805.0,0.0,0,ALMION
160512409,электрический роликовый,1242.0,4.4,416,Массажер для спины и шеи
169486675,Миостимулятор для мышц,1000.0,3.0,9,GOODSGOGO
355632516,"Электроды для миостимулятора, липучки 1 шт",1489.0,0.0,0,NoName
217346252,Массажер электрический для шеи и спины,1695.0,4.1,9,CheckZero
415977628,Массажер электрический перкуссионный,3376.0,0.0,0,ElectricOnline
240021806,Массажер для ног и тела электрический микротоковый коврик,423.0,0.0,0,RuMir
388672590,Эффективный массажёр для ног,966.0,0.0,0,
336214169,Уникальный массажёр для ног с миостимуляцией,870.0,0.0,0,
108706496,Цифровой Меридиан,633.0,0.0,0,Массажер миостимулятор для терапии
354628102,Вибрационный массажер для лица и шеи,1845.0,0.0,0,ElectrimassagerCorp
224084105,Массажер подушка для шеи,1863.0,4.6,228,AlPHA технологии
269827691,"GESS EMS EMIOS, Массажер, 1мл",4683.0,0.0,0,Mivis
348367775,Электроды для миостимулятора,460.0,0.0,0,
243635907,Массажер умный электрический для головы,947.0,4.3,67,Sharif Shop
406534140,Миостимулятор,4763.0,0.0,0,
279867034,Импульсный массажер для ног EMS миостимулятор,602.0,0.0,0,EMS FOOT MASSAGER
264416812,Массажер для ног электрический,401.0,0.0,0,EMS FOOT MASSAGER
261329510,Массажер для ног электрический,394.0,0.0,0,EMS FOOT MASSAGER
240363622,Массажер для ног,744.0,4.5,2,О'kay
429792560,Миостимулятор Тазового Дна,3800.0,0.0,0,
253787122,Электронный пластырь импульсная бабочка YTK2017,435.0,0.0,0,
393678636,LED маска для лица светодиодная аппарат для омоложения,1051.0,0.0,0,
396430526,Уникальный массажёр для ног расслабление и здоровье,1244.0,0.0,0,Best787
427012661,Миостимулятор Тазового Дна,2861.0,0.0,0,
229899357,Массажер для ног электрический микротоковый,319.0,4.3,29,
360878524,Массажер для тела электрический микротоковый с подогревом,1610.0,0.0,0,ElectricOnline
311819626,Массажер для тела от целлюлита,6063.0,0.0,0,
311834727,Вибромассажер,6582.0,0.0,0,
311840966,Массажер - для лица роликовый,6376.0,0.0,0,
311826908,Массажный пистолет - для тела,6278.0,0.0,0,
311833826,Массажный пистолет,6178.0,0.0,0,
335845338,перкуссионный массажер,6064.0,0.0,0,
311833105,Микротоковый массажер,6057.0,0.0,0,
261413063,Беспроводной массажёр с автоматической адаптацией,1230.0,0.0,0,Five Stars
311815904,Массажный пистолет,6430.0,0.0,0,
311867345,Массажер для лица роликовый,6330.0,0.0,0,
311820124,Массажер для тела для похудения,6313.0,0.0,0,
311867232,Массажер для шеи - электрический,6216.0,0.0,0,
311826602,Массажер для лица,6265.0,0.0,0,
311828938,Массажер электрический,6086.0,0.0,0,
311824257,Электромассажер для тела,5974.0,0.0,0,
145171298,электрический для шеи и плеч,941.0,4.3,7,Массажер
219212105,Универсальный массажёр для шеи и спины,1211.0,0.0,0,SUNDAY FUN
337945715,Массажер для ног,1008.0,0.0,0,
167765920,Электрическая массажная подушка для шеи,1024.0,4.2,5,Home Time
311831190,Массажер от целлюлита,6223.0,0.0,0,
311819879,Перкуссионный массажер спортивный,6041.0,0.0,0,
219209303,Интенсивный массажёр для шеи,1214.0,0.0,0,SUNDAY FUN
222110729,Электрический микротоковый коврик,1186.0,5.0,1,Твой Массажист
219212036,Массажёр с настройкой режимов,1251.0,0.0,0,SUNDAY FUN
311902905,Массажер для лица от отеков,6142.0,0.0,0,
311816205,Микротоковый массажер,6069.0,0.0,0,
257909664,Массажёр 6 режимов массажа,1230.0,0.0,0,
311816619,Массажер пистолет,6187.0,0.0,0,
311935973,Массажер для шеи - электрический,6008.0,0.0,0,
143706614,Микротоковый массажер для лица лифтинг электрический EMS,2943.0,4.8,939,Beauty Home A&N
331834855,Массажер для шеи и спины электрический импульсный,4393.0,0.0,0,ElectrimassagerCorp
397414537,Массажер для ног и тела электрический коврик EMS,410.0,0.0,0,RuMir
397414650,Массажер для ног и тела электрический коврик EMS,442.0,0.0,0,RuMir
255482119,Массажер для ног и стоп электрический роликовый с подогревом,8699.0,4.9,1567,Keona
259612222,массажер электрический,1222.0,0.0,0,AND
303416797,Массажер для ног и тела электрический коврик,499.0,0.0,0,RuMir
257908691,Универсальный массажёр для шеи,1206.0,0.0,0,
230918063,Электрический массажёр воротник для шеи,596.0,3.9,8,Simple Home
381029251,"Массажёр для пресса и рук Luazon LEM-37, 6 режимов, 3",967.0,0.0,0,Luazon Home
410960955,Массажер для лицалифтинг,2364.0,0.0,0,
369058533,Массажёр для ног релакс и здоровье каждый день,738.0,0.0,0,
217383606,Массажер электрический для шеи и спины,2220.0,4.2,5,SportBoom
388860317,36-режимный 3-в-1 массажный миостимулято,1997.0,0.0,0,
199168055,Массажер Пояс Тренажер Электрический Миостимулятор,745.0,4.2,45,домашние трофеи
379512828,"Эффективный массажер для тела ""Бабочка""",412.0,0.0,0,
150959206,Перкуссионный массажный пистолет для тела,2242.0,4.4,10,Boluojun Booster
417776546,Массажер Пояс Тренажер Электрический Миостимулятор EMS,824.0,0.0,0,RuMir
160830134,Массажер-коврик микротоковый для ног,534.0,3.9,7,Optmobilion
257897063,"Электрический головной массажер для головы, лица и тела",896.0,4.5,29,Like Home
253527882,Массажер для ног и тела электрический коврик EMS,463.0,0.0,0,RuMir
305672708,Микротоковый массажер для лица,987.0,1.0,1,RuMir
66901472,Электромассажер для шеи и плеч с подогревом мини-массажер,644.0,0.0,0,NG MM
311849228,Массажер - для лица роликовый,6231.0,0.0,0,
311846806,Массажер для головы,6074.0,0.0,0,
185597911,Массажер электрический для шеи,1680.0,5.0,2,TiMe_LeSs
386137561,Массажер для похудения живота миостимулятор для пресса пояс,1833.0,0.0,0,Plantos
311856882,Массажный пистолет - для тела,5986.0,0.0,0,
311820342,Перкуссионный массажер ручной,6967.0,0.0,0,
311821706,Массажный пистолет для ног,6265.0,0.0,0,
398196226,Перкуссионный массажер для тела,1119.0,0.0,0,
311855958,Массажер для спины и шеи,6417.0,0.0,0,
311849972,Массажер для лица от отеков,5954.0,0.0,0,
311822005,Массажер для шеи ручной,6952.0,0.0,0,
311818702,Массажер для тела вибромассажер,6367.0,0.0,0,
336928025,Электромассажёр для пресса и рук,1138.0,0.0,0,Luazon Home
79719455,Нарукавники электроды для миостимулятора массажера,388.0,4.7,3983,AShop
311823138,Массажер для шеи электрический,6859.0,0.0,0,
311819996,Вибромассажер для тела,6574.0,0.0,0,
311817335,Массажер для тела вибромассажер,6310.0,0.0,0,
311822948,Перкуссионный массажер Аскардо,6624.0,0.0,0,
311819033,Массажный пистолет спортивный,6436.0,0.0,0,
299415010,Массажер электрический для ног коврик,497.0,0.0,0,ALLinMALL
401064506,Массажёр для ягодиц с виброплатформой,1294.0,0.0,0,
366556924,Массажер электрический для шеи спины и тела,1395.0,0.0,0,
385615329,"Эффективный массажер для тела ""Бабочка""",575.0,0.0,0,
259600327,Массажёр с функцией активного восстановления,1204.0,0.0,0,Santa Monica
258280986,Массажер для ног,623.0,0.0,0,
117996039,Массажер миостимулятор цифровой Мередиан,458.0,3.6,7,KASTAL
317957243,Массажер для ног электрический коврик,378.0,3.6,12,Bahora shop
173018929,Массажер для шеи и плеч,1401.0,4.3,6,Simple Home
173018931,Массажер для шеи и плеч,1347.0,5.0,3,Trend Brend
262928386,Пояс-миостимулятор для похудения,834.0,4.2,19,LoveNova
196953780,EMIOS Массажер EMS для тела,4603.0,0.0,0,GESS
259062551,Электростимулятор на пояс,2760.0,0.0,0,Goods Good
329524906,Эффективный массажер для шеи и спины,1913.0,0.0,0,Neck Massager
329524902,Умный массажер для шеи и плеч,1673.0,0.0,0,Inveso
404724261,Электроимпульсный тренажер для пресса и рук,1231.0,0.0,0,
261334026,Массажер для ног электрический,412.0,0.0,0,EMS FOOT MASSAGER
230918067,Массажёр импульсный для шеи,938.0,0.0,0,Home Time
314669780,Эффективный массажёр для ног,1145.0,0.0,0,массажер для ног электрический
418686538,Массажный матрас электрический массажер для спины и тела,4932.0,4.7,1207,STARRKO
88064207,Массажер для лица,4360.0,4.6,107,Mezonica
222205818,Массажер электрический для ног миостимулятор,903.0,0.0,0,POCO
222205813,Массажер электрический для ног миостимулятор,854.0,0.0,0,HOCO
264382874,Массажер для ног электрический миостимулятор,379.0,4.0,1,EMS
371756284,Массажер для шеи спины и тела,1210.0,4.7,1452,
140699703,Косметический микротоковый вибромассажер для лица,1670.0,4.6,600,Dimarket
370735600,Универсальный массажер для шеи и плеч,1933.0,0.0,0,Inveso
388216661,Миостимулятор для лица и шеи,707.0,0.0,0,Domestic
233650481,Массажер для шеи спины и тела электрический,1359.0,4.5,30,Харитоsh_Все для Вас
401323848,Массажер для похудения живота миостимулятор для пресса пояс,2119.0,0.0,0,
261329531,Массажер для ног электрический,529.0,0.0,0,EMS FOOT MASSAGER
218714643,Массажер для тела перкуссионный EN-759,1268.0,0.0,0,Energy
217349294,Воротник - массажер,1517.0,0.0,0,ONECHOISE
146982635,Электрический микротоковый вибромассажер для шеи и спины,718.0,4.0,4,yes world
214565437,Микротоковый массажер для ног и стоп электрический,489.0,4.0,8,yes life
159659909,Микротоковый массажер для лица косметический RF лифтинг,1831.0,4.6,755,swisscare
148839374,для шеи электрический,1675.0,5.0,1,Массажер
311828510,Массажер - для ног и ступней,6044.0,0.0,0,
335858505,перкуссионный массажер,7598.0,0.0,0,
311827518,Массажер для ног и ступней,6693.0,0.0,0,
311956258,Массажер - для ног и ступней,6620.0,0.0,0,
311903195,Массажер электрический,6576.0,0.0,0,
311827936,Массажер для шеи электрический,6126.0,0.0,0,
181271983,"Электрический косметический массажер для шеи, спины и тела",1533.0,4.5,1509,Electro Shop
311816923,Массажеры для лица,6513.0,0.0,0,
311971762,Перкуссионный массажер спортивный,6016.0,0.0,0,
207686107,Миостимулятор массажер для пресса,486.0,3.3,4,Сезон товаров
311972116,Перкуссионный массажер для тела,6583.0,0.0,0,
311908050,Массажер для ног и ступней,6470.0,0.0,0,
259603125,Профессиональный массажный аппарат для шеи,1228.0,0.0,0,AND
310351264,Массажер для подтяжки лица Skinny Chin импульсный,1932.0,0.0,0,GESS
418838706,Массажер омолаживающий и от морщин для лица и шеи,1200.0,0.0,0,
418834332,Массажер для лица и шеи от морщин,1089.0,0.0,0,
342091857,Массажер для пресса 6 режимов,642.0,0.0,0,Luazon Home
219210484,Импульсный беспроводной массажёр для шеи,1208.0,0.0,0,SUNDAY FUN
364804043,Электрический массажер для ног,651.0,0.0,0,
198127497,Массажер для ног электрический миостимулятор,415.0,3.7,19,EMS
413348180,Пояс для похудения миостимулятор для пресса,1520.0,0.0,0,Win shop
430394231,Электро-массажёр для ног с множеством режимов,963.0,0.0,0,
416057111,Массажер для шеи воротниковой зоны электрический импульсный,2076.0,0.0,0,ElectricOnline
313058074,Универсальный массажёр для ног с миостимуляцией,721.0,0.0,0,
353591595,Реабилитационный тренажер для рук и ног после инсульта,2171.0,4.7,3,
413803131,Массажер перкуссионный электрический вибромассажер,1668.0,0.0,0,Massager gun
371797801,Пояс-миостимулятор для похудения,894.0,0.0,0,Domestic
255619595,Микротоновый массажер для шеи плеч головы спины,380.0,4.4,35,Good box
226159793,электрический массажер для спины и шеи,1610.0,4.5,434,ТЕХНО ЛАЙН
388080645,"Массажёр для ног, миостимулятор, 6 режимов, чёрный",777.0,0.0,0,Luazon Home
222629643,Массажер для шеи и спины электрический импульсный JT-88,1185.0,4.6,78,GOODSTORAGE
43759256,Электроды к миостимулятору импульсному массажеру для пресса,272.0,4.7,3983,AShop
408241463,Электроды для миостимулятора массажера 5х5 см 6 шт 6шт,641.0,0.0,0,
315116101,Релакс для ног ваш путь к здоровью и комфорту,926.0,0.0,0,Массажер
420695827,Массажер тренажер для ягодиц,1552.0,0.0,0,
408241471,Электроды для миостимулятора 5х5 см 8 шт Цвет 8,744.0,0.0,0,
408457663,Электроды для миостимулятора (набор 4 шт ) 8х5 см,607.0,0.0,0,
165450701,Тренажер массажер EMS для ног,866.0,4.3,3933,ARNAHealth
389881462,Аэродинамический массажер для полного расслабления,1150.0,0.0,0,
224810184,"Массажер для шеи, спины и тела",1177.0,4.4,9,ECOHOMELY
222658505,Профессиональный микротоковый аппарат рф лифтинг для лица,4281.0,4.8,413,Kirei Tech
287911411,Массажер для шеи и спины электрический импульсный,431.0,4.0,4,Амелия З.
275039484,Антицеллюлитный массажер для тела электрический с насадками,842.0,5.0,2,Hill house
390932926,Эффективный тренажер для мышц пресса и рук,1268.0,0.0,0,
163368176,Массажёр для ног микротоковый,354.0,4.0,16,Китайская медицина
151044815,Массажер для ног электрический,688.0,3.9,75,АРТ ПОДАРКИ
314692372,Массажёр для ног расслабление и здоровье,786.0,0.0,0,Массажер
253735796,Массажер - воротник для шеи и спины,1300.0,4.5,11,Domins
311832890,Электромассажер,6878.0,0.0,0,
311827687,Массажер для похудения,6295.0,0.0,0,
219212142,Профессиональный массажёр для снятия усталости,1210.0,0.0,0,SUNDAY FUN
311831404,Перкуссионный массажер - для тела,6276.0,0.0,0,
257895970,Массажер электрический с разными режимами для шеи и спины,1237.0,0.0,0,Angie by Angel
257893161,Массажер электрический-снимет усталость шеи спины и плеч,1232.0,0.0,0,
381230073,Электромагнитный массажер для шеи,714.0,4.8,48,LenMar
162765110,Массажер для ног электрический коврик,436.0,5.0,4,EMS массажер для ног
337800824,перкуссионный массажер,6506.0,0.0,0,
253414338,Антицеллюлитный массажер для тела с ЕМС и прогревом MIO,6586.0,0.0,0,Electric massager
258266146,Электрический массажный пояс для похудения L329,1222.0,5.0,2,Batme
254822176,Виброплатформа для похудения,5555.0,5.0,3,BAGEL
261414731,Персонализированный массажёр с терапевтическим нагревом,1241.0,0.0,0,Five Stars
134574347,"Электроды Easysnap Perfomace, 5х10 см (2шт, 2кл.)",1939.0,5.0,9,Compex
218741454,Массажер для ног электрический коврик микротоковый EMS,268.0,3.6,17,
224346075,Электромассажер для ног EMS,426.0,3.5,37,Selard
355632971,Электроды для миостимулятора электрического массажера,1783.0,0.0,0,NoName
239721777,Микротоковый массажер для шеи,740.0,0.0,0,RuMir
353480660,массажер для тела,1545.0,0.0,0,MassagerarmechanicaX
354628275,Вибрационный массажер для лица и шеи,1845.0,0.0,0,ElectrimassagerCorp
348874757,Массажер для ног электрический коврик,1637.0,0.0,0,ElectrimassagerCorp
347752404,Массажер для шеи спины головы электрический микротоковый,1622.0,0.0,0,ElectrimassagerCorp
311822264,Массажер для тела ручной,6291.0,0.0,0,
311831008,Массажер для лица роликовый,6336.0,0.0,0,
311960504,Массажер антицеллюлитный,6273.0,0.0,0,
335852508,перкуссионный массажер,6190.0,0.0,0,
311833683,Массажер антицеллюлитный,6074.0,0.0,0,
311817253,Перкуссионный массажер для спины,5961.0,0.0,0,
261413441,Интенсивный низкочастотный массажёр,1218.0,0.0,0,
371882867,Массажер электрический для тела,1463.0,0.0,0,ElectrimassagerCorp
257896924,Функциональный-электромассажер для шеи спины и плеч,1247.0,0.0,0,
365795187,Пояс-миостимулятор для похудения,956.0,0.0,0,Quick purchases
311936334,Массажный пистолет,5988.0,0.0,0,
219210413,Массажёр для шеи с индивидуальными настройкам,1258.0,0.0,0,SUNDAY FUN
311823275,Массажный пистолет спортивный,5970.0,0.0,0,
257909947,Низкочастотный массажёр для шеи с автономной работой,1241.0,0.0,0,Amber heart
311828103,Массажер для лица,6322.0,0.0,0,
257896989,Массажер для шеи и спины-снимет болевые ощущения и усталость,1234.0,0.0,0,AND
257909012,Эргономичный массажёр для ежедневного использования,1208.0,0.0,0,Amber heart
257896363,Удобный и эффективный массажер для шеи и спины,1281.0,0.0,0,Angie by Angel
261416836,Низкочастотный массажёр для улучшения кровообращения,1209.0,0.0,0,Five Stars
257895739,Роликовый массажер для лица-убирает морщины и омолаживает,1214.0,0.0,0,
261900502,Электроды для миостимулятора 5х9 см,339.0,4.5,70,
