id,name,price,rating,feedbacks,brand
401738310,Электрический миостимулятор,845.0,0.0,0,amazing moment
401731428,Электрический миостимулятор,845.0,0.0,0,PRODUSHOP
238026623,Миостимулятор массажер электрический,670.0,4.3,10,BarryHome
138800327,Стимулятор мышц Массажер для тела миостимулятор,289.0,3.7,23,Миостимулятор для шеи
431398495,Электромиостимулятор для тонуса мышц,1260.0,0.0,0,
341507222,Эффективный миостимулятор для идеальных ягодиц,6621.0,0.0,0,
335270591,Эффективный миостимулятор для ягодиц,974.0,0.0,0,
347405871,Умный миостимулятор для эффективных тренировок,2002.0,0.0,0,
224371116,Импульсный массажер для ног EMS миостимулятор,364.0,4.0,18,Selard
181490069,"Электроды для миостимулятора, липучки",253.0,4.8,3214,AllerShop
198454135,Миостимулятор для пресса,659.0,4.1,22,Миостимулятор тренажер для мышц
199414295,Массажер электрический миостимулятор,3659.0,0.0,0,ElectricOnline
255121960,Миостимулятор Ассоль (РУ),51636.0,0.0,0,Эсма
399685041,Миостимулятор для ног с массажными функциями,741.0,0.0,0,
172074822,Миостимулятор импульсный массажер бабочка,350.0,0.0,0,Domestic
214337249,Массажер для спины и шеи микротоковый миостимулятор,213.0,4.4,230,GO SHOP
97582682,Массажер миостимулятор для похудения,704.0,3.7,38,Grand House
347405831,Эффективный миостимулятор для пресса и рук,1583.0,0.0,0,
264416819,Импульсный массажер для ног EMS миостимулятор,428.0,0.0,0,EMS FOOT MASSAGER
197599608,Массажер Тренажер электрический миостимулятор импульсный,538.0,3.8,24,Missis A
19354594,Тренажер миостимулятор для мышц пресса рук ног,416.0,4.1,168,GoodStore24
124954087,"Массажер для похудения тела, миостимулятор для пресса",765.0,3.7,19,SLAUTIN BRAND
399812802,Миостимулятор для пресса и рук — тонкая и подтянутая фигура,867.0,0.0,0,
257646465,Массажер для тела электрический миостимуляция,341.0,5.0,1,Сезон товаров
247781618,Микротоковый массажер для лица RF лифтинг,1198.0,4.7,3815,Louvo
145026652,для терапии,769.0,4.0,4,массажер миостимулятор
366578478,Миостимулятор для эффективной тренировки,928.0,0.0,0,
339063845,Эффективный миостимулятор для ягодиц,891.0,0.0,0,
380651862,Миостимулятор для тела Ваш личный массажист,392.0,0.0,0,
376841852,Массажер для тела электрический без провода,746.0,3.8,5,Domestica
426441205,Миостимулятор для комфорта ног,1343.0,0.0,0,подарок
177530379,Миостимулятор для мышц,916.0,0.0,0,GOODSGOGO
173241055,Микротоковый массажер для лица электрический RF лифтинг,1047.0,4.8,6727,"""ng beauty"""
404636874,Электрический миостимулятор для мышц тела,1045.0,0.0,0,
404653845,Электро-Миостимулятор для ягодиц,1039.0,0.0,0,
399151670,Миостимулятор для идеального пресса и рук,1111.0,0.0,0,
411092343,Миостимулятор для ног — релаксация и уход,751.0,0.0,0,
427262543,Миостимулятор для ног А-47 – комфорт и здоровье,678.0,0.0,0,
399115056,Миостимулятор для ног А-47 — эффективный массажер,652.0,0.0,0,
407929832,Миостимулятор для ног с инновационной технологией,572.0,0.0,0,
354628618,Электрический массажер микротоковый миостимулятор,1694.0,0.0,0,ElectrimassagerCorp
330027207,массажер электрический миостимулятор,6088.0,0.0,0,NO NAME
346959992,Миостимулятор USB мини массажер для тела бабочка,1551.0,0.0,0,ElectrimassagerCorp
371883633,Массажер миостимулятор лимфодренажный,1440.0,0.0,0,ElectrimassagerCorp
395375178,Электрический миостимулятор для пресса,1043.0,0.0,0,Luazon Home
155635403,Электроды для миостимулятора массажера электрического,305.0,4.6,548,AShop
171168086,Массажер Миостимулятор Тренажер,746.0,4.3,16,Scales
353280841,Сменные пластины на миостимулятор бабочка,1500.0,0.0,0,ElectrimassagerCorp
98521504,Электроды для миостимулятора массажера электрического,372.0,4.7,3983,AShop
397116122,Миостимулятор бабочка и электроды для миостимулятора липучки,1598.0,0.0,0,Миостимулятор электрический
401733576,Электрический миостимулятор для пресса,603.0,0.0,0,LoveNova
40619307,массажер для подтяжки лица Skinny Chin GESS-680,1409.0,0.0,0,GESS
212473760,Мини массажер бабочка электрический,436.0,3.9,8,М.А.Г.
330449547,Массажер электрический миостимулятор,4041.0,0.0,0,NO NAME
391229843,Эффективный массажер для тела с миостимуляцией,780.0,0.0,0,
407066498,Эффективный миостимулятор для идеальных ягодиц,1124.0,0.0,0,
372336189,Эффективный миостимулятор для идеальных форм,1018.0,0.0,0,
328939357,Эффективный миостимулятор для идеальных ягодиц,984.0,0.0,0,
369013018,Миостимулятор для идеального тела,1579.0,0.0,0,
296221030,Массажер маска миостимулятор для лица микротоковый,4473.0,4.3,11,
305957119,Антицеллюлитный массажер для тела миостимулятор,652.0,0.0,0,RuMir
377410251,"Миостимулятор для пресса, пояс для похудения",2255.0,0.0,0,ElectrimassagerCorp
369564499,Эффективный миостимулятор для тела,1254.0,0.0,0,
152237351,Массажный коврик миостимулятор электрический для стоп ног,291.0,3.8,8,NaSiBa
378626759,Секрет идеальных ягодиц миостимулятор нового поколения,1221.0,0.0,0,
421806424,Пояс электрический жиросжигающий массажер для похудения EMS,2664.0,0.0,0,
305973128,Антицеллюлитный массажер для тела миостимулятор,622.0,0.0,0,RuMir
381481115,Миостимулятор для тела Технология легкости и комфорта,761.0,0.0,0,
384233433,Миостимулятор для идеального тела без усилий,1040.0,0.0,0,
347448946,Эффективный миостимулятор для пресса и рук,966.0,0.0,0,
349472921,Электростимулятор для мышц,1862.0,0.0,0,
174603535,Миостимулятор тренажер для мышц и ягодиц,552.0,0.0,0,Planet Earth
175865699,Миостимулятор импульсный массажер бабочка,303.0,3.6,20,Сезон товаров
168677017,Миостимулятор,1316.0,3.6,5,CASaDEl
156232292,Массажер для шеи электрический миостимулятор компактный,1074.0,0.0,0,A.D.R.C.
381213635,Эффективный миостимулятор для пресса и рук,765.0,0.0,0,
381214325,Эффективный миостимулятор для идеальных ягодиц,732.0,0.0,0,
411873069,Эффективный миостимулятор для красивых ягодиц,2684.0,0.0,0,
418152069,Массажер для ног электрический. Миостимулятор для стоп,411.0,0.0,0,Алия&
418153809,Массажер для ног электрический. Миостимулятор для стоп,567.0,0.0,0,Алия&
418153085,Массажер для ног электрический. Миостимулятор для стоп,567.0,0.0,0,Алия&
229539758,Миостимулятор массажер тренажер для тела пресса и рук,522.0,4.3,334,Тренажер для пресса
205355872,Массажер коврик миостимулятор,539.0,0.0,0,SILAPRO
401738312,Электрический миостимулятор для пресса,843.0,0.0,0,Trendy Homeware
174614939,Электрический массажер микротоковый миостимулятор,428.0,3.8,14,Housesion
378626586,Эффективный миостимулятор для идеальных ягодиц,1148.0,0.0,0,
431398341,Миостимулятор для ягодиц,1166.0,0.0,0,
431398340,Миостимулятор для ягодиц,1092.0,0.0,0,
431398337,Миостимулятор для ягодиц,1014.0,0.0,0,
431398501,Электростимулятор для мышечного комфорта,1327.0,0.0,0,
431398493,Электростимулятор для мышц,1182.0,0.0,0,
139725412,Массажер для шеи и плеч импульсный миостимулятор,767.0,4.7,76,REDSEN
174691648,Микротоковый массажер для лица от отеков и морщин,2252.0,4.7,2646,LUXLIFTING
410067771,Эффективный миостимулятор для идеального тела,1324.0,0.0,0,
195627739,Импульсный массажер для ног EMS миостимулятор,364.0,3.6,16,EMS FOOT MASSAGER
249068660,Миостимулятор на пояс,800.0,3.7,9,Goods Good
343271795,Эффективный миостимулятор для идеальных ягодиц,1737.0,0.0,0,
345819474,Эффективный миостимулятор для идеальных ягодиц,1222.0,0.0,0,
224366837,Электромассажер для ног миостимулятор массажный коврик EMS,345.0,4.2,51,Selard
231139563,Миостимулятор массажер для терапии,831.0,3.9,9,
230320718,Массажер миостимулятор для ног шеи спины и тела,618.0,4.5,83,Другой мир
158599375,Миостимулятор для пресса электрический,1992.0,0.0,0,Goods Good
413284433,Миостимулятор для тела с эффектом бабочки,1536.0,0.0,0,
274734389,"Электрический косметический массажер для шеи, спины и тела",599.0,5.0,1,Hill country
343272563,Эффективный миостимулятор для подтянутых ягодиц,1560.0,0.0,0,
223764329,Миостимулятор массажер для терапии,831.0,3.9,9,
238258083,Импульсный мини массажёр -миостимулятор для тела 2 шт,554.0,0.0,0,Отой
415978000,Перкуссионный массажер миостимулятор 3 в 1,4604.0,0.0,0,ElectricOnline
264416820,Массажер электрический Mini Massager для тела миостимулятор,315.0,0.0,0,EMS Mini Massager
373432640,Электростимулятор для мышц,1785.0,0.0,0,
386088170,Эффективный миостимулятор для идеального тела,890.0,0.0,0,
366500726,Массажный Пояс-Миостимулятор,830.0,0.0,0,comfort home
410879523,Миостимулятор для тела тренировка и релаксация,1483.0,0.0,0,
329721832,для идеального пресса и рук,1150.0,0.0,0,Миостимулятор
257471835,Мини массажер электро-импульсный,343.0,4.1,16,Mini massage stike
418154657,Массажер для ног электрический. Миостимулятор для стоп,411.0,0.0,0,Алия&
329470777,Эффективный миостимулятор для идеальных ягодиц,1192.0,0.0,0,
316439325,Массажер для спины и шеи миостимулятор,218.0,3.8,12,
369563739,Эффективный миостимулятор для подтянутых ягодиц,1021.0,0.0,0,
428325479,Электромиостимулятор для упругих ягодиц,1068.0,0.0,0,
211579760,Охлаждающий массажер - маска для лица и головы,966.0,4.7,72,head ICE ICE
404542191,Эффективный миостимулятор для формирования ягодиц,906.0,0.0,0,
164943658,Массажер тренажер для ягодиц,556.0,0.0,0,HOMEBASIS
428517756,Электромиостимулятор для мышц тела и рук,1203.0,0.0,0,
371897585,Миостимулятор пояс для пресса,2776.0,0.0,0,ElectrimassagerCorp
139397818,Миостимулятор тазового дна Кегель массажер для женщин,3835.0,4.7,192,Ms.Mila
345917256,Эффективный миостимулятор для идеальных ягодиц,1150.0,0.0,0,
418376523,Электромиостимулятор для тела — Тонус и стройность,839.0,0.0,0,Huawei
330081978,Миостимулятор массажер импульсный электрический для тела,3721.0,0.0,0,NO NAME
379512899,Эффективный массажер-миостимулятор для тела,407.0,0.0,0,
239514901,Миостимулятор массажер электрический многофункциональный,724.0,4.0,1,SNDHome
399460144,"Массажер для ног миостимулятор, 6 режимов",581.0,0.0,0,Luazon Home
331266352,Миостимулятор для мышц,397.0,0.0,0,
263078429,Массажер для шеи спины и головы электрический миостимулятор,889.0,4.3,3,HomeMarket24/7
329385668,Эффективный для идеальных ягодиц,927.0,0.0,0,Миостимулятор
313081277,Электрический массажер микротоковый миостимулятор для тела,418.0,0.0,0,OKSi
366505832,Пояс для похудения Миостимулятор,923.0,0.0,0,comfort home
341049081,Миостимулятор для лица и всего тела массажер электрический,837.0,0.0,0,RuMir
331186188,Миостимулятор для тела антицеллюлитный массажер VACU NeoBody,7582.0,0.0,0,NO NAME
329107463,Эффективный миостимулятор для ягодиц,752.0,4.0,1,
404602909,Миостимулятор для ног с инновационной технологией,794.0,0.0,0,
419441593,Спортивный массажер миостимулятор для тела электрический,958.0,0.0,0,BarryHome
346960062,USB мини массажер для тела бабочка Миостимулятор,1414.0,0.0,0,ElectrimassagerCorp
341012635,Миостимулятор массажер для тела электрический,839.0,0.0,0,RuMir
419438505,Спортивный массажер миостимулятор для тела электрический,958.0,4.3,10,BarryHome
239022891,Шнур переходник миостимулятора электрического массажера 4 шт,578.0,4.7,764,The Basket
369013002,Миостимулятор для пресса и рук,1296.0,0.0,0,
329470901,Эффективный миостимулятор для ягодиц,1262.0,0.0,0,
328939407,Эффективный миостимулятор для идеальных ягодиц,1107.0,0.0,0,
338779617,Эффективный миостимулятор для идеальных ягодиц,1104.0,0.0,0,
327208968,Эффективный миостимулятор для рук и пресса,1063.0,0.0,0,
419636736,Компактный миостимулятор для тела и мышечного тонуса,906.0,0.0,0,
391853771,Миостимулятор для физиотерапии массажер электрический,815.0,0.0,0,RuMir
369002676,Миостимулятор массажер для лица и тела электрический,670.0,0.0,0,RuMir
377410602,Миостимулятор для тела,1840.0,0.0,0,ElectrimassagerCorp
335370660,Эффективный миостимулятор для идеального тела,1350.0,0.0,0,
412031987,Массажер-миостимулятор для идеального тела,420.0,0.0,0,
370844516,Эффективный миостимулятор для идеальных ягодиц,1161.0,0.0,0,
185524979,Электростимулятор для мышц 6 в 1,1508.0,0.0,0,ВС_ВСЕ по Вкусам
234421780,Электрический массажер для тела миостимулятор в подарок,565.0,4.0,18,AlKarDar
413563794,Электромиостимулятор для упругих ягодиц,639.0,0.0,0,
165459822,Массажер для тела лица ног электрический для шеи,281.0,4.2,30,INAMORA CASA
223943400,Миостимулятор для тела и и пресса,338.0,3.8,18,Магазин низких цен
406472048,Электромиостимулятор для тела — Тонус и стройность,702.0,0.0,0,
414437687,Массажер для ног электрический EMS миостимулятор,341.0,0.0,0,
354709533,Формирующий миостимулятор для подтянутых ягодиц,1345.0,0.0,0,
245816625,Массажёр для шеи подушка массажная,196.0,4.0,9,Noveexpress
176135675,Микротоковый массажер для лица электрический лифтинг,3272.0,4.9,1330,"""ng beauty"""
249559436,Массажер миостимулятор,621.0,0.0,0,EVE
390413678,Электроды для миостимулятора,401.0,5.0,4,VOXORIA
401731393,Электрический миостимулятор для пресса,843.0,0.0,0,HOMEBASIS
413271778,Миостимулятор для формирования ягодиц,2993.0,0.0,0,
369514940,Электростимулятор для мышц,662.0,4.8,57,
371145359,Перкуссионный массажер миостимулятор 3 в 1,4604.0,0.0,0,ElectricOnline
222440433,"Электрод для миостимулятора коленный, размер L",6273.0,0.0,0,TEXEL
246814829,Пояс миостимулятор для пресса,645.0,3.8,31,IDAGOODS
309989502,Миостимулятор массажер для тела,492.0,0.0,0,
260000075,Массажер электрический (миостимулятор) для ног,267.0,0.0,0,м пяать звезд
310993913,Вакуумный антицеллюлитный массажер для тела ног и ягодиц,1120.0,4.7,41,Fivory
394871292,Эффективный миостимулятор для идеальных ягодиц,1039.0,0.0,0,
419898102,Эффективный миостимулятор для идеального тела,953.0,0.0,0,
348874557,Электрический массажер микротоковый миостимулятор,2026.0,0.0,0,ElectrimassagerCorp
354832695,Эффективный миостимулятор для пресса и рук,1153.0,0.0,0,массажеры
63585106,Электрод для миостимулятора Theragun,1754.0,5.0,9,PowerDot
114369276,"Электроды для миостимуляторов Beurer, Bluetens 5х5см, 4шт",641.0,4.8,752,Mиостимулятор
242733777,Тренажер для пресса и тела миостимулятор электрический EMS,611.0,0.0,0,yes cosiness
411206177,Эффективный миостимулятор для тела,1077.0,0.0,0,
409935426,Эффективный миостимулятор для тела,1077.0,0.0,0,
209110845,Миостимулятор для пресса элекрический,937.0,0.0,0,Trend Brend
389880511,Эффективный массажер-миостимулятор для тела,1016.0,0.0,0,
360383158,Эффективный миостимулятор для тренировки,1379.0,0.0,0,
400741725,Электрический миостимулятор для пресса,917.0,0.0,0,
242733860,Электрический массажер для мышц миостимулятор для пресса,623.0,0.0,0,yes world
230894585,Миостимулятор для мышц ягодиц,426.0,4.4,141,Rustem's store
413452261,Стимулятор для мышц живота,3113.0,4.3,2078,"Ура, приехало!"
398624036,Электроимпульсный миостимулятор для ягодиц и бедер,1320.0,0.0,0,
375485021,Эффективный миостимулятор для ягодиц,975.0,0.0,0,
420211880,Электромиостимулятор для мышц тела,1256.0,0.0,0,
349050094,Миостимулятор для тела LEM-29 голубой,3554.0,0.0,0,Luazon
205822581,Электрический массажер микротоковый миостимулятор,232.0,3.8,18,VICTORIABUSINESS
413906179,Массажёр для ног миостимулятор 6 режимов,1828.0,0.0,0,
160765703,Массажер бабочка,332.0,0.0,0,ArmStore-lux
399965582,Эффективный миостимулятор для красивых ягодиц,1836.0,0.0,0,
400732565,Электрический миостимулятор для пресса,861.0,0.0,0,HomeSphere
389412279,Комплексный миостимулятор для идеальной формы,1261.0,0.0,0,
28211498,Массажер для шеи электрический массажёр для миостимулятор,1352.0,0.0,0,DOKTORTATTO
328947817,Эффективный Миостимулятор для Тела,1381.0,0.0,0,
329721590,Эффективный миостимулятор для идеального тела,1112.0,0.0,0,миостимулятор 3в1
413295361,миостимулятор для ягодиц,1006.0,0.0,0,
398623788,Электронный миостимулятор для формирования ягодиц,1320.0,0.0,0,
288063427,Массажер для спины и шеи микротоковый миостимулятор,407.0,3.7,9,Missis A
372790985,Эффективный миостимулятор для ягодиц,949.0,0.0,0,
203812668,EMS миостимулятор вибрационный тренажер для мышц,276.0,4.1,18,Carlam
192163308,USB мини массажер для тела бабочка Миостимулятор,372.0,3.9,7,Missis A
376886063,Массажер для ягодиц электрический без провода,722.0,3.8,5,Domestica
428177278,Электромиостимулятор для тела с уникальной технологией,2262.0,0.0,0,
404724265,Миостимулятор для мышц пресса и рук,1188.0,0.0,0,
433002034,Электромиостимулятор для тела Бабочка,868.0,0.0,0,
433016065,Электромиостимулятор для тела — Тонус и стройность,817.0,0.0,0,
197264424,перчатка для миостимулятора массажера,629.0,0.0,0,
421128420,Инновационный миостимулятор для тонуса тела,652.0,0.0,0,
155633367,Электроды к миостимулятору импульсному массажеру для пресса,275.0,4.6,548,AShop
223975841,Массажер для ног и стоп электрический коврик миостимулятор,569.0,0.0,0,SmartDevice
371896664,Миостимулятор для терапии массажер электрический цифровой,2107.0,0.0,0,ElectrimassagerCorp
398156582,ЭлектроМиостимулятор для пресса и рук — тонус и фитнес,1043.0,0.0,0,Luazon Home
218742223,Тренажер массажер для мышц брюшного пресса,842.0,4.3,11,PodarkinDom
162831246,Электроды к миостимулятору импульсному массажеру для пресса,301.0,4.6,548,AShop
400019857,Массажёр для ног. миостимулятор. 6 режимов,615.0,0.0,0,Youine
341445353,Эффективный миостимулятор для идеальных ягодиц,702.0,0.0,0,
365031889,Пояс для похудения Миостимулятор,911.0,0.0,0,azimova
397130797,Инновационный аппарат для укрепления ягодиц,974.0,0.0,0,
