id,name,price,rating,feedbacks,brand
164031800,Интеллектуальный электрический импульсный массажер для шеи,1108.0,5.0,3,MigMax
397449519,Массажер для ног и тела электрический коврик EMS,430.0,0.0,0,RuMir
251300728,Массажер для шеи электрический импульсный микротоковый,1028.0,4.6,86,MIT HOUSE
196854224,Массажер Пояс Тренажер Электрический Миостимулятор,523.0,0.0,0,Сезон товаров
196335928,"Массажер EMS для ног электрический коврик, 8 режимов",662.0,0.0,0,ANYSMART
336761090,Умный массажёр для стройности и тонуса,1533.0,0.0,0,
322495502,Электрический массажер для пресса и живота,1014.0,0.0,0,Спортивный электрический массажер/Ударный массажер
374980626,Массажер для ног и тела электрический микротоковый,429.0,0.0,0,RuMir
391991759,Массажер тренажер для ягодиц,1428.0,0.0,0,
152626453,Миостимулятор-тренажер для тела бабочка,288.0,4.1,37,Optmobilion
365118006,Миостимулятор массажер для тела и пресса,657.0,0.0,0,RuMir
76426457,Электрод для массажера,571.0,4.8,147,Sam and Fox
391292973,Массажер Бабочка для глубокого расслабления,909.0,0.0,0,
369376741,Эффективный стимулятор для идеальных ягодиц,1061.0,0.0,0,
411902705,"Массажёр для пресса и рук Luazon LEM-37, 6 режимов, 3 пульта",1751.0,0.0,0,Luazon Home
403218903,Инновационный массажер для идеальных форм,894.0,0.0,0,Спортивный электрический массажер/Ударный массажер
164794282,массажер,424.0,4.5,8,Family conveyor
322495504,Портативный массажер для идеальных форм,1073.0,0.0,0,Спортивный электрический массажер/Ударный массажер
309366009,миостимулятор для мышц,2461.0,0.0,0,
344352592,Массажер миостимулятор для шеи ног и спины электрический,1765.0,0.0,0,
329436888,Электрический микротоковый массажёр для лица и шеи,3148.0,4.9,34,BuyForHome
216565249,Массажер для тела электрический миостимуляция,203.0,3.5,25,Bahora shop
218879866,Массажер электрический для ног коврик,551.0,5.0,1,ELINA STORE
331884936,Массажер для лица микротоковый бандаж электрический,4423.0,0.0,0,NO NAME
252194821,для похудения,6599.0,5.0,2,Виброплатформа
377237866,Электрический массажер для шеи и тела,1234.0,0.0,0,
164943656,Массажер тренажер для ягодиц,493.0,0.0,0,GOODSGOGO
329982524,Массажер для шеи электрический массажёр для миостимулятор,2373.0,0.0,0,NO NAME
348369951,Электроды для миостимулятора,403.0,5.0,6,
384005013,EMS Массажер электрический для ног,384.0,4.4,23,DEVADE
218979469,Массажер для стоп микротоковый,351.0,3.8,4,NANA Technology
265001262,Массажер для ног и рук электрический,335.0,3.3,3,Mashrab Shop
68385834,Миостимулятор тренажер для пресса вибромассажер для тела,539.0,4.0,67,NG XXII
391436315,Миостимулятор для тела и пресса,441.0,0.0,0,
218707262,Массажер микротоковый для лица и шеи,1618.0,4.8,98,МанТа
259526511,Массажер для ног,513.0,0.0,0,zip
224998075,Массажер EMS для ног электрический коврик 8 режимов,707.0,5.0,1,ANYSMART
261329521,Массажер для ног электрический,500.0,4.5,4,EMS FOOT MASSAGER
401600633,Массажёр для пресса и рук с множеством режимов,1310.0,0.0,0,Luazon Home
43761117,Электроды для миостимулятора электрического массажера,381.0,4.7,3983,AShop
280489429,Массажер многофункциональный для лица и шеи,567.0,4.8,187,MVcarrot
347833138,Массажер миостимулятор для спины шеи и тела электрический,1457.0,0.0,0,CosmetimassagerEdge
355629831,Электростимулятор для идеального тела,957.0,0.0,0,
219461941,Массажер для головы электрический мурашка,1842.0,4.6,794,KidSSMART
353280918,Массажер для ног электрический массажный коврик,1701.0,0.0,0,ElectrimassagerCorp
383562289,Умный массажёр для идеальной фигуры,1499.0,0.0,0,Luazon Home
393063832,Массажёр для пресса и рук 6 режимов чёрный,1179.0,0.0,0,
303471498,Тренажер миостимулятор для пресса,638.0,4.4,71,RuMir
420156304,Вибромассажер для тела,968.0,0.0,0,LUNA
420146177,Массажер для похудения,962.0,0.0,0,azimova
421079831,Электро-массажер для тела с эффектом бабочки,748.0,0.0,0,
420156307,Пояс EMS,968.0,0.0,0,Scales
404891409,Массажер для ног с миостимуляцией и электропорацией,571.0,0.0,0,
391596894,Импульсный миостимулятор для лечения всего тела,1459.0,0.0,0,
402071705,Массажёр-миостимулятор для ног с 6 режимами,729.0,0.0,0,Luazon Home
419142667,Электроды для миостимулятора липучки,408.0,0.0,0,
430394429,Массажёр для ног с миостимуляцией и режимами,998.0,0.0,0,
422029091,Массажёр для пресса и рук с 6 режимами и 3 пультами,1472.0,0.0,0,
422029391,Массажёр для мышц пресса и рук с 6 режимами,1349.0,0.0,0,
425837223,Массажёр для пресса с 6 режимами,1702.0,0.0,0,
428069280,Массажеры для глаз рук режимов пульта хааа,1237.0,0.0,0,
428998071,Инновационный массажёр для тела с 6 режимами,1060.0,0.0,0,
409968821,Массажёр для пресса с режимами,969.0,0.0,0,
410237989,Массажёр для ног с миостимуляцией 6 режимов,922.0,0.0,0,
394448939,Массажёр для ног с миостимуляцией 6 режимов,922.0,0.0,0,
392498547,Массажёр для ног с миостимуляцией 6 режимов,916.0,0.0,0,
430548997,Массажёр для пресса с 6 режимами и автоматом,897.0,0.0,0,
383754724,"Массажёр для пресса и рук, 6 режимов, чёрный",1107.0,0.0,0,Luazon Home
322232433,Электрический массажер для тела,344.0,0.0,0,
341852253,Эффективный миостимулятор для идеальных ягодиц,956.0,0.0,0,Массажеры для тела
392298460,Массажёр для пресса и рук 6 режимов чёрный,1112.0,0.0,0,
315429798,Массажер для ног электрический коврик,398.0,0.0,0,
251341861,Вакуумный антицеллюлитный массажер для тела ног и ягодиц,1175.0,4.7,4585,HomelySpa
419142799,Электроды для миостимулятора липучки,408.0,5.0,5,
265367037,Массажер Меридиан миостимулятор для мышц лица и всего тела,452.0,4.8,6,Apelsin
261332767,Массажер для ног электрический,1046.0,4.5,2,EMS FOOT MASSAGER
379549731,Устранение усталости массажёр для ног,1042.0,0.0,0,
175378395,Электрический массажер микротоковый миостимулятор,413.0,3.0,3,Homemania
230736815,Аккумуляторный импульсный массажёр,1214.0,5.0,1,FancyPoint
401876830,Аппарат миостимуляции B-333 TNX 10-ти канальный,17391.0,0.0,0,TechNovoX
397108258,Микротоки электроды для миостимулятора липучки,1690.0,0.0,0,для похудения
265075001,Коврик массажер для ног и стоп электрический,345.0,4.2,5,TV SHOP KHAN
242043316,Массажер для ног и стоп электрический с пультом,808.0,0.0,0,Deadline
172875130,Миостимулятор тренажер для мышц и ягодиц,729.0,3.0,2,comfort home
205027828,Массажер Nozomi MH-102,3564.0,4.9,148,AND
393626902,Формула идеальных ягодиц без усилий,952.0,0.0,0,
305073119,массажер бабочка,332.0,0.0,0,Missis A
354833770,Универсальный массажер для тела,1262.0,0.0,0,Массажер для тела антицеллюлитный
319253992,массажер наклейка,560.0,0.0,0,Missis A
400648475,Массажер для ног электрический миостимулятор,878.0,0.0,0,EMS
399981513,Портативный тренажер для ягодиц и бедер,1161.0,0.0,0,
319248646,массажер наклейка,560.0,0.0,0,Missis A
68385844,"Миостимулятор тренажер для мышц пресса тела, Электрический в…",545.0,4.2,20,Дом быта 63
404612752,Электроимпульсный тренажер для ягодиц,946.0,0.0,0,
263597292,"Электрический косметический массажер для шеи, спины и тела",1405.0,4.7,6078,Rellax&massage
358212202,Электрический массажер для ног и стоп,7194.0,4.7,2337,KORPHOUS
420565671,Массажер для ног с миостимуляцией и расслаблением,997.0,0.0,0,
381481108,"Эффективный массажер для тела ""Бабочка""",724.0,0.0,0,
375040979,Электромассажер-миостимулятор акупунтурн,2279.0,0.0,0,MassagerarmechanicaX
369753462,массажер бабочка,417.0,0.0,0,Missis A
196739566,Электрический массажер для ног и стоп,8928.0,4.9,1567,Keona
409875930,Электроимпульсный тренажер для пресса и рук,1030.0,0.0,0,
151183926,Миостимулятор массажер Бабочка на пресс,402.0,3.4,188,TEXNIKA
331018165,Цифровой меридиан импульсный инструмент,1076.0,0.0,0,
271020938,Массажер для шеи и спины электрический импульсный,920.0,0.0,0,BuyBox
263109602,Массажный пояс для похудения вибромассажер электрический,1165.0,4.4,25,For the house
333997473,Эффективный миостимулятор для ягодиц,637.0,0.0,0,Массаж
398372204,Эффективный электростимулятор для тренировки мышц,990.0,0.0,0,
390060146,Преобразите фигуру с миостимулятором для ягодиц,816.0,0.0,0,
399914635,Электроимпульсный тренажер для мышц пресса и рук,989.0,0.0,0,
369904451,Массажер для шеи и тела,906.0,0.0,0,
330294046,Массажер миостимулятор электрический для тела,1414.0,0.0,0,NO NAME
257907790,Беспроводной массажёр для ежедневного использования,1204.0,0.0,0,Amber heart
401543001,Компактный массажёр для пресса с 6 режимами,713.0,0.0,0,Luazon Home
357267701,Эффективный стимулятор для идеальных ягодиц,816.0,0.0,0,
401600577,Массажёр для пресса и рук с 6 режимами и 3 пультами,1189.0,0.0,0,Luazon Home
227738444,Массажер для тела,286.0,0.0,0,Warehouse
414236240,Электроимпульсный тренер для пресса и рук,1133.0,0.0,0,
402604750,Электроимпульсный тренажер для пресса и рук,1024.0,0.0,0,
368053609,Массажер для шеи и тела,987.0,0.0,0,
346640271,Миостимулятор FZ-1 массажер электрический,2503.0,0.0,0,
242733859,"Массажер миостимулятор для пресса, тела и ягодиц тренажер",599.0,0.0,0,yes life
403993716,Инновационный аппарат для тонуса ягодиц,1036.0,0.0,0,
146995902,Набор миостимуляторов для пресса Похудение Фитнес Тренажер,545.0,4.0,4,yes house
249257284,"Массажер для ног, массажерный расслабляющий коврик для ног",1082.0,0.0,0,MyPads
373335334,Массажер для ног электрический,313.0,5.0,8,
250572130,Электрический массажер для ног,682.0,0.0,0,OBOSI
239995237,Тренажер для пресса живота,4023.0,4.7,503,Supretto
412189468,Массажёр для ног с микротоками и режимами,1175.0,0.0,0,
195627581,Массажер для ног электрический,370.0,4.1,48,EMS FOOT MASSAGER
420688735,Массажер тренажер для ягодиц,1573.0,0.0,0,
343433060,Массажер тренажер для ягодиц,1541.0,0.0,0,
366776235,Мини массажер,248.0,3.8,89,sanleo
312601189,Массажер для лица и шеи глаз от отеков морщин микротоковый,1263.0,4.7,5036,Chernika
170923753,Массажер миостимулятор,746.0,3.2,13,azimova
211898286,Массажер для лица и шеи электрический от морщин,420.0,4.7,24,DILIMSHOP
395377475,Эффективный массажёр для пресса с 6 режимами,1073.0,0.0,0,Luazon Home
350293329,Массажер для лица электрический RF лифтинг микротоковый,2496.0,4.9,142,mal'vi
375674756,"Провод 3 в 1 для зарядки type-c, шнур lightning, micro usb",253.0,4.5,341,Миостимулятор массажер
361960945,Импульсный массажер для шеи и воротниковой зоны TENS,1270.0,4.5,15,Evo Beauty
380117058,для похудения,7245.0,0.0,0,виброплатформа
193216849,"Электроды для стимуляции груди миостимулятор массажер, 16 см",531.0,4.6,548,AShop
420695800,Массажер тренажер для ягодиц,1482.0,0.0,0,
177613721,Массажный матрас электрический массажер для спины и тела,7419.0,4.7,1207,STARRKO
161953258,Косметический микротоковый вибромассажер для лица,2133.0,4.6,600,Dimarket
264374838,Импульсный массажер для ног EMS,402.0,0.0,0,Foot Massager
315278670,Миостимулятор FZ-1 массажер электрический,6433.0,0.0,0,
250134925,Электрический массажер для ног и стоп,9366.0,4.9,1567,Keona
237219628,Массажер для тела EMIOS,3274.0,0.0,0,Gess
350685837,Перкуссионный массажер пистолет для шее спины и тела,2889.0,5.0,7,
102190292,EM 29 Миостимулятор Масажёр,5566.0,5.0,1,Beurer
322495537,Эффективный массажер для идеального пресса,1133.0,0.0,0,Спортивный электрический массажер/Ударный массажер
178970610,Массажер для ног микротоковый,967.0,4.2,5,GG256Beauty
175317198,Массажер миостимулятор для спины шеи и тела электрический,278.0,3.6,16,SUSULUHome
331872905,Пояс электрический жиросжигающий массажер для похудения,6307.0,0.0,0,ElectrimassagerCorp
238149065,Массажер для спины,293.0,0.0,0,массажеры
227735896,Массажер для тела,288.0,0.0,0,A Home Dream
371798291,Пояс-миостимулятор для похудения,886.0,0.0,0,Trendy Homeware
357253211,Электроды для миостимулятора самоклеящиеся,417.0,4.8,160,
379502848,Электростимулятор для мышц,1705.0,0.0,0,
420692781,Массажер тренажер для ягодиц,1482.0,0.0,0,
385525481,Ультрасовременное устройство для подтяжки ягодиц,1101.0,0.0,0,
349467314,Массажер электрический для шеи спины и тела,2393.0,0.0,0,
122800823,Маска электрод для стимуляции лица миостимулятора массажера,610.0,4.7,3983,AShop
264416803,Массажер для ног электрический,402.0,0.0,0,EMS FOOT MASSAGER
383511077,"Массажёр для ног с миостимуляцией, 6 режимов",866.0,0.0,0,Luazon Home
329722246,Электростимулятор для идеального тела,1150.0,0.0,0,Массажер для пресса
390236173,Массажер миостимулятор цифровой,609.0,0.0,0,Home enquire
401901670,Виброплатформа для похудения тренажер кардио степпер,5114.0,0.0,0,Wide_Store
402159201,Импульсный миостимулятор для лечения всего тела,1411.0,0.0,0,
402112648,Импульсный миостимулятор для лечения всего тела,1406.0,0.0,0,
387412634,"Эффективный массажер для тела ""Бабочка""",477.0,0.0,0,
362463292,массажер бабочка,381.0,0.0,0,
169313564,Массажер миостимулятор,686.0,3.7,6,LOW PRICES
425035034,Электромиостимулятор для упругих ягодиц,1221.0,0.0,0,
424615013,Электромиостимулятор для ног А-47 – эффективный массажер,706.0,0.0,0,
421079709,Эффект бабочки инновационный массажер для тела,609.0,0.0,0,
288079758,Массажер для шеи электрический,322.0,5.0,1,Missis A
430551863,Массажёр для пресса и рук с 6 режимами,2402.0,0.0,0,
430551781,Массажёр для пресса и рук с 6 режимами,1508.0,0.0,0,
425837198,Электромассажёр для пресса с множеством режимов,1384.0,0.0,0,
410261731,Массажёр для пресса и рук 6 режимов чёрный,1256.0,0.0,0,
410276638,Массажёр для пресса и рук 6 режимов чёрный,1256.0,0.0,0,
430548990,Электро-массажёр для пресса с 6 режимами,1164.0,0.0,0,
425836409,Массажёр для пресса с множеством режимов,1066.0,0.0,0,
431338555,Электромассажёр для пресса с множеством режимов,1016.0,0.0,0,Luazon Home
410229811,Массажёр для ног с миостимуляцией 6 режимов,922.0,0.0,0,
410224438,Массажёр для ног с миостимуляцией 6 режимов,922.0,0.0,0,
391229999,"Эффективный массажер для тела ""Бабочка""",780.0,0.0,0,
428446138,Массажёр для пресса с разными режимами,781.0,0.0,0,
278875276,EMS Массажер электрический для ног,796.0,0.0,0,ЕМ
154629476,EMS Массажер электрический для ног,511.0,3.8,5,yashouse
209110844,Пояс для похудения электрический,930.0,0.0,0,HomeSphere
218853538,Вибромассажер массажный пояс,938.0,0.0,0,Domio
307426264,Массажер для пресса и рук 6 режимов,1196.0,0.0,0,Luazon Home
289907305,"Массажёр для пресса LMZ-052, 6 режимов",1165.0,0.0,0,Luazon Home
307426305,Массажер для пресса и рук 6 режимов,1166.0,0.0,0,Luazon Home
290018742,"Массажёр для пресса и рук LEM-37, 6 режимов",933.0,0.0,0,Luazon Home
173244161,Электрический EMS микротоковый вибромассажер для лица и шеи,1827.0,4.4,352,Dimarket
263597293,"Электрический косметический массажер для шеи, спины и тела",1398.0,4.7,6078,Rellax&massage
297145723,Пояс для похудения электрический,861.0,0.0,0,PodarkinDom
419142665,Электроды для миостимулятора,465.0,0.0,0,
349592420,Электроды для миостимулятора массажера,465.0,0.0,0,
158182042,"Электроды для миостимулятора, из нетканого материала 2",656.0,4.9,42,Wikielement
212822487,Массажер миостимулятор электрический тренажер для пресса,589.0,4.0,20,Missis A
331883092,Массажер электрический для ног коврик,419.0,0.0,0,ДЮpro1000
419805673,Массажер для лица и шеи от морщин микротоковый,887.0,0.0,0,BilionerШа
417380786,массажер для тела для ног для спины шеи,431.0,0.0,0,msi
417383749,массажер для тела для ног для спины шеи,431.0,0.0,0,msi
417388127,массажер для тела для ног для спины шеи,387.0,0.0,0,msi
417387230,массажер для тела для ног для спины шеи,370.0,0.0,0,msi
417388866,массажер для тела для ног для спины шеи,387.0,0.0,0,msi
417323467,массажер для тела для ног для спины шеи,387.0,0.0,0,msi
417386490,массажер для тела для ног для спины шеи,387.0,0.0,0,msi
155176028,USB мини массажер для тела бабочка Миостимулятор,332.0,4.3,154,ДаниМарк
120707830,Фитнес пояс для пресса 819 EMS,888.0,4.2,9,Zohar
417382061,массажер для тела для ног для спины шеи,431.0,0.0,0,msi
417382753,массажер для тела для ног для спины шеи,431.0,0.0,0,msi
197306510,Электрический импульсный массажер для шеи,567.0,0.0,0,
369556160,Умный стимулятор для формирования ягодиц,1059.0,0.0,0,
410258113,Массажёр для пресса и рук 6 режимов чёрный,1172.0,0.0,0,
324135823,массажёр для ног с миостимуляцией,992.0,0.0,0,
232410772,миостимулятор для мышц,2734.0,0.0,0,
237504448,Массажер электрический для похудения,830.0,3.8,5,HomeMarket24/7
158638505,Массажер электрический для ног и стоп коврик,470.0,3.8,8,MGhome
215329985,Стимулирующий массажный коврик для ног Массажер,521.0,0.0,0,MM_brand
209111163,Пояс для похудения живота Миостимулятор,938.0,3.0,2,LUNA
257817570,Пояс для похудения живота массажер,786.0,4.5,103,SABERI
379727162,Комфортный массаж для ваших ног,1065.0,0.0,0,
364802896,Мини-массажёр для тела,455.0,0.0,0,
263064418,Массажер для шеи и плеч электрический воротник импульсный,1115.0,5.0,2,YASIN
346516739,Микротоновый массажер для шеи плеч головы спины,387.0,0.0,0,
232410773,миостимулятор для мышц,2734.0,0.0,0,
362468713,Массажер электрический для шеи спины и тела,807.0,0.0,0,
375824069,Цифровой импульсный меридиан,1234.0,0.0,0,
223641436,Миостимулятор массажер для пресса EMS,434.0,3.0,2,GO SHOP
184656736,Электрический массажер микротоковый миостимулятор,310.0,3.2,13,2M.shop
378767759,Массажер для тела электрический,1547.0,4.6,22,
79718495,Перчатки электроды для миостимулятора массажера лечебные,551.0,4.7,3983,AShop
197869109,Электроды для миостимуляции маленькие 5пар,1274.0,4.9,37,
390971595,Массажер миостимулятор для шеи ног и спины электрический,15958.0,0.0,0,
166654272,Электроды для миостимулятора,237.0,4.8,2918,A-LINE
391334953,Массажер миостимулятор для шеи ног и спины электрический,3095.0,0.0,0,
