id,name,price,rating,feedbacks,brand
397455530,Массажер миостимулятор для тела пресса спины шеи микротоки,1278.0,4.7,71,eFlow
221329577,Миостимулятор 36 программ антицеллюлитный для похудения,2052.0,4.9,1021,
334678554,Миостимулятор 48 программ массажер для похудения,4196.0,4.9,1021,
359420749,Миостимулятор для тела антицеллюлитный для похудения,1945.0,4.9,13,
221352035,Миостимулятор 36 программ массажер для похудения,1847.0,4.9,1021,
91028354,Миостимулятор массажер импульсный электрический для тела,2543.0,4.6,561,AShop
169351017,"Миостимулятор FZ-1 ""ШУБОШИ"" для мышц",3986.0,4.9,365,SHUBOSHI
251013688,"Миостимулятор FZ-2 ""ШУБОШИ"" для мышц",4001.0,4.9,365,SHUBOSHI
282070221,Миостимулятор медицинский для тела Impulse Neuro,19219.0,4.9,7,IMPULSE DEVICE
141376926,Миостимулятор электрический для тела и для похудения,3565.0,4.9,343,REMASO
35995950,"Миостимулятор FZ-1 ""ШУБОШИ"" для мышц",3846.0,4.9,545,SHUBOSHI
381945504,миостимулятор массажер для тела электрический,4629.0,5.0,5,
313886483,Миостимулятор массажер электрический для всего тела,1118.0,4.2,16,
143533250,"Массажер миостимулятор для тела, спины, шеи и поясницы",2867.0,4.7,2166,TARGO
389208236,Миостимулятор массажер электрический для всего тела,2211.0,4.2,16,
414478019,миостимулятор массажер для тела электрический,4925.0,5.0,5,
198641294,Миостимулятор Массажер электрический Тренажер для пресса,509.0,4.3,1187,Missis A
178910159,Импульсный миостимулятор для лечения всего тела JR-309A,1165.0,4.6,1281,AllerShop
209567982,Миостимулятор массажер тренажер для тела пресса и рук,589.0,3.9,18,Missis A
366555972,Портативный массажер-миостимулятор для тела Орион,14793.0,4.9,7,IMPULSE DEVICE
43996867,Массажер миостимулятор для тела электрический,621.0,4.6,2748,"Ура, приехало!"
148830492,Массажер для тела Миостимулятор электрический импульсный,2115.0,4.6,442,Dizezo
389224197,Электроды для миостимулятора набор 10 штук,580.0,4.2,16,
268558045,Миостимулятор для тела электрический массажер,535.0,4.2,30,AlMaxBar
212081515,массажер электрический миостимулятор,2232.0,4.7,187,Dimarket
187998611,"Массажер миостимулятор для шеи, ног и спины электрический",7577.0,4.9,166,Dykemann
250135346,Мышечный миостимулятор электрический массажер для тела,1199.0,4.6,698,ROASTERS
141936084,Миостимулятор для тела и и пресса,361.0,4.3,8854,nazare
291888914,Спортивный массажер миостимулятор для тела электрический,2792.0,4.7,2166,TARGO
312901930,"Миостимулятор для пресса и рук, массажер для тела",638.0,4.6,1772,Furellia
44081627,Миостимулятор для пресса тренажер ABS Trainer MIO,5012.0,4.7,1504,Yamaguchi
236596238,"Электростимулятор для мышц, массажер миостимулятор",818.0,4.6,1772,FURVIREA
250133162,"Миостимулятор 36 программ, антицеллюлитный для похудения",1896.0,4.6,698,ROASTERS
405488947,Тренажер-миостимулятор для тазового дна и пресса для женщин,3555.0,0.0,0,JAMECO
365851028,Миостимулятор массажер импульсный электрический для тела,1112.0,4.8,50,
114150729,Аппарат миостимуляции B-333,11108.0,4.7,302,Estetik Beauty Body
346462615,"Массажер миостимулятор Incentivo, 36 режимов",2450.0,4.6,698,ROASTERS
328814914,Тренажер-миостимулятор для тазового дна и пресса для женщин,3693.0,4.9,243,Excellent Style
391596895,Импульсный миостимулятор для лечения всего тела,1104.0,0.0,0,
395814854,Массажер миостимулятор микротоки для мышц импульсный,1270.0,5.0,1,
306073689,Массажер миостимулятор с тапками и поясом,12410.0,4.9,166,Dykemann
260607223,Реабилитационный тренажер для рук и ног после инсульта,2447.0,4.8,556,ReBalance
192370914,Массажер для шеи и плеч электрический миостимулятор,2235.0,4.6,292,
159323506,Массажер для лица микротоковый бандаж электрический,1990.0,4.6,999,Vilab
325679235,Массажер для ягодиц EMS,2342.0,3.9,15,MVcarrot
418581928,Миостимулятор массажер бабочка,491.0,4.7,37,
418588315,Миостимулятор бабочка массажер,452.0,4.7,37,
343099404,Физиотерапевтический аппарат миостимулятор электрический,4453.0,4.6,698,ROASTERS
314738795,миостимулятор массажер электрический,484.0,4.7,44,
400432951,Мышечный миостимулятор электрический массажер для тела,1138.0,0.0,0,ROASTERS
85701168,Миостимулятор для женского здоровья EMBAGYN Pelvic Exerciser,11464.0,4.4,209,
418584790,Массажер миостимулятор бабочка с пультом,450.0,4.7,37,
61124788,Миостимулятор EMS-750 тренажер массажер,5709.0,4.8,3276,Planta
313142574,"Реабилитационный тренажер, миостимулятор для рук и ног",1876.0,4.6,20,ROASTERS
281044797,Миостимулятор для тела массажер для спины,833.0,4.8,27,
321178342,Массажер миостимулятор тренажер,423.0,4.3,44,
353888946,Аппарат миостимуляции для тела B-333A,9345.0,5.0,22,
318374112,Массажер миостимулятор для всего тела электрический,1742.0,4.6,570,KEP Ko
236420653,Миостимулятор массажер для тела электрический,915.0,4.6,2748,"Ура, приехало!"
276152044,"Электроды массажер миостимулятор, набор 14 штук",580.0,4.7,71,eFlow
314416549,Массажер электрический миостимулятор,5097.0,4.5,1151,Evo sante
147669017,Массажер миостимулятор,9413.0,4.7,64,Миоток
313622916,"Миостимулятор для тела, массажер для спины",1346.0,4.6,1772,Furellia
355476774,Массажер миостимулятор для тела пресса спины шеи микротоки,1772.0,4.7,71,eFlow
104503339,Массажер миостимулятор для тела EMS-300,3032.0,4.8,3276,Planta
248288568,миостимулятор массажер электрический,488.0,4.4,191,м пять звезд
264221158,Миостимулятор для тела с лор насадкой,1668.0,4.6,1772,Furellia
283209701,Микротоковый массажер для глаз и лица электронные патчи EMS,2732.0,4.2,17,MVcarrot
160527057,Электрический миостимулятор для тела и мышц,965.0,4.6,570,KEP Ko
108786610,Массажер электрический миостимулятор,1409.0,4.5,1151,Evo sante
359403403,Миостимулятор EMS-200 тренажер для пресса,2211.0,5.0,4,
315057523,миостимулятор массажер электрический,449.0,4.5,342,
318375411,Массажер миостимулятор для всего тела электрический,868.0,4.6,570,KEP Ko
63558655,"Миостимулятор Theragun 2.0 UNO, красный",13409.0,4.2,10,PowerDot
211631109,LED маска для лица светодиодная аппарат для омоложения,1515.0,4.8,878,IN MAR
366132108,Массажер миостимулятор микротоковый бабочка,590.0,4.9,766,
217790915,Миостимулятор массажер импульсный электрический для лица,603.0,4.7,764,The Basket
44096937,Миостимулятор для шеи и поясницы NECK Trainer MIO,4513.0,4.7,1504,Yamaguchi
322913969,Миостимулятор массажер для тела,1010.0,3.8,83,
171541891,Миостимулятор массажер для терапии,503.0,4.4,524,Lieblich Hause
312901173,"Миостимулятор для тела, массажер для спины",579.0,4.6,1772,Furellia
213035053,"Электроды для миостимулятора, липучки",338.0,4.7,764,The Basket
225747953,Аппарат для миостимуляции тела Формирование фигуры B-333,10918.0,5.0,22,
264135194,Массажер для похудения живота миостимулятор для пресса пояс,698.0,4.1,1755,Plantos
178777119,Массажер миостимулятор тренажер,472.0,4.5,929,YOUR&STORE
304946773,"Миостимулятор для тела, массажер для спины",1392.0,5.0,9,Furellia
251230891,Массажер миостимулятор,2234.0,4.8,162,VOXORIA
226314337,"EVA Миостимулятор для лица и тела, против старения кожи",5349.0,4.9,50,TensCare
360630281,Пояс миостимулятор для похудения Biolift4 M13,6549.0,4.7,102,Gezatone
387714846,Антицеллюлитный массажер для тела для похудения,3460.0,4.9,25,EVELLA
414687020,Микротоковый массажер для лица и шеи RF лифтинг EMS LED,3261.0,5.0,261,
365033020,Массажер миостимулятор микротоки для мышц импульсный,884.0,5.0,2,
137802648,Электроды для миостимулятора,980.0,4.8,752,Mиостимулятор
48331295,Электрод для миостимулятора Neck Trainer MIO,1903.0,4.7,698,Yamaguchi
20880491,Миостимулятор EMS-200 тренажер для пресса,2174.0,4.8,3276,Planta
349602560,Электроды для миостимулятора,465.0,5.0,5,
268655279,Миостимулятор,231.0,0.0,0,LenDar
399491740,Массажер для тела микротоковый,486.0,4.7,753,Массажер электрический
315410371,миостимулятор массажер электрический,451.0,4.4,191,
231599744,"Миостимулятор массажер для тела,тренажер кегеля EMS",2254.0,4.4,120,Ms.Mila
183867687,для спины шеи тела ног электрический,500.0,4.5,341,Миостимулятор массажер
209568635,Миостимулятор массажер тренажер для тела пресса и рук,582.0,5.0,2,Missis A
204716562,Миостимулятор,883.0,4.5,1776,FURVIREA
239622627,Миостимулятор для всего тела,406.0,4.3,2245,classic trends
253495405,Массажер женский миостимулятор для увеличения и роста груди,2197.0,4.6,561,AShop
114380703,Электроды для миостимулятора,493.0,4.8,752,Mиостимулятор
114380704,Электроды для миостимулятора,623.0,4.8,752,Mиостимулятор
409882128,Миостимулятор,892.0,0.0,0,
394606252,Электрический миостимулятор для тела и мышц,2449.0,4.6,570,KEP Ko
114380705,Электроды для миостимулятора,768.0,4.8,752,Mиостимулятор
252040073,Тренажер-миостимулятор для пресса и тазового дна,3123.0,4.4,165,ROASTERS
303471880,Тренажер миостимулятор для пресса,624.0,4.0,31,RuMir
421731874,Электроды для миостимулятора,403.0,0.0,0,
248848833,Миостимулятор массажер для пресса и рук,661.0,0.0,0,Ms.House
226794955,Perfect BEAUTY миостимулятор для лица и тела,3871.0,4.9,50,TensCare
289722163,Массажный пояс миостимулятор для пресса XXL-XXXL,542.0,4.3,80,весна з
388668815,Миостимулятор массажер для тела электрический,1631.0,5.0,2,
152741697,Микротоковый массажер для лица миостимулятор Medi Lift Plus,48920.0,4.8,31,Ya-Man
259328627,Миостимулятор массажер для терапии,485.0,4.5,103,SABERI
212330837,Миостимулятор для создания вашего тела,436.0,0.0,0,RHinaHome
208677727,Миостимулятор массажер для пресса EMS,434.0,4.2,19,GO SHOP
313653841,Массажер миостимулятор цифровой,467.0,4.1,148,
248313961,Миостимулятор для мышц EMS Smart Fitness,423.0,4.6,53,м пяать звезд
208641480,Миостимулятор для пресса,567.0,0.0,0,Missis A
228980934,Электроды для массажера миостимулятора,504.0,5.0,32,REMASO
51722457,Пульт управления к миостимуляторам Controller,1501.0,4.7,126,Yamaguchi
247358941,Миостимулятор для тела и пресса,239.0,4.1,15,весна з
238530340,Миостимулятор для тела импульсный массажер ног шеи спины,1977.0,4.6,18,TOTAR
114369277,Электроды для миостимулятора,454.0,4.4,72,Mиостимулятор
191290143,Миостимулятор массажер для тела рук ног электрический,2150.0,4.4,120,Ms.Mila
239513231,Миостимулятор массажер электрический многофункциональный,707.0,0.0,0,SNDHome
74807917,Массажер для тела миостимулятор 10 режимов,807.0,4.8,20,Luazon Home
268558041,"Миостимулятор для пресса и рук, массажер",544.0,4.2,30,AlMaxBar
338260463,Антицеллюлитный массажер для тела KIO,26802.0,5.0,3,WAU
160298010,EMS массажер миостимулятор для ног и тела,205.0,4.2,160,тидор
232413557,Мини миостимулятор 2 шт,449.0,4.4,112,MARETTA
362178861,Микротоковый массажер для лица и тела,1795.0,4.8,1959,BodyRave
267661377,"Миостимулятор, массажер импульсный для всего тела",1366.0,4.0,5,ANYSMART
225777089,"Миостимулятор-массажер ""Бабочка"" для тела",408.0,4.0,9,Superopt
27541382,Миостимулятор EMS-350 тренажер массажер,2687.0,4.8,3276,Planta
369543748,Миостимулятор для тела с лор насадкой,1767.0,4.8,55,Furellia
204010629,миостимулятор массажер электрический,449.0,4.5,342,весна з
313722271,Миостимулятор для тела и и пресса,158.0,4.0,85,
205918276,Электроды для миостимулятора,413.0,4.8,752,Миостимулятор
44696286,Массажер для шеи и плеч миостимулятор электрический,991.0,4.7,2445,Ortech
51787540,Миостимулятор массажер электрический,1411.0,4.6,872,Evo sante
175937204,Миостимулятор вибромассажер для тела,1490.0,0.0,0,Товары для массажа
236802936,Виброплатформа тренажер для похудения,5539.0,4.9,854,P&F
258435392,Миостимулятор для ног FOOT Trainer MIO,7946.0,4.7,1504,Yamaguchi
111856960,Электроды для миостимулятора,876.0,4.8,752,Mиостимулятор
391995393,Миостимулятор,883.0,0.0,0,
399383114,Микротоковый массажер для лица RF лифтинг,1617.0,5.0,1,
205923302,"Комплект электродов для миостимуляторов 4,6х7,5 см 4 шт",526.0,4.8,752,Миостимулятор
218774930,Миостимулятор-массажер EM80,9579.0,5.0,6,Beurer
231139981,Миостимулятор массажер для терапии,809.0,4.1,22,
401984438,Миостимулятор массажер электрический Тренажер для тела,436.0,0.0,0,
269273309,"Миостимулятор для пресса, пояс для пресса",981.0,4.6,1772,Furellia
220795333,Миостимулятор Pelvifine тазового дна,4474.0,4.6,698,ROASTERS
376566743,Массажер миостимулятор для тела электрический,615.0,4.4,8,
232357064,Миостимулятор для мышц EMS Smart Fitness,433.0,4.5,139,весна з
341040406,Миостимулятор для физиотерапии массажер электрический,837.0,0.0,0,RuMir
394600906,Электрический миостимулятор для тела,4327.0,4.6,570,KEP Ko
389973980,Токопроводящие электроды для миостимулятора набор,212.0,5.0,1,
141319553,Массажер для шеи тела импульсный миостимулятор электрический,1037.0,4.7,1801,Ortech
317402050,Массажёр миостимулятор для ягодиц,875.0,4.1,9,
354659688,Портативный электрический массажер миостимулятор,1070.0,4.7,187,Dimarket
14154692,"Пояс-миостимулятор для похудения, тренажер пресса M10",3708.0,4.6,322,Gezatone
341020098,Миостимулятор массажер электрический для тела,887.0,1.0,1,RuMir
421697359,Электроды для миостимулятора,460.0,0.0,0,
158142293,Электроды липучки 4 шт для миостимулятора,455.0,4.7,1818,КРАСОТА & ЗДОРОВЬЕ
299036854,Электроды для миостимулятора 16 штук,574.0,4.7,187,Dimarket
378722454,Массажер миостимулятор микротоки для мышц импульсный,1708.0,5.0,2,
177482005,Миостимулятор EM49 белый,8097.0,4.9,34,Beurer
414886841,"Миостимулятор для пресса, пояс для пресса",1054.0,4.8,55,Furellia
217165605,Пояс миостимулятор для пресса и похудения,742.0,4.1,148,MARETTA
227829011,Массажер электрический миостимулятор,1346.0,4.6,17,Shopping House
205940010,Электроды для миостимулятора,725.0,4.8,752,Миостимулятор
111898083,Электроды для миостимуляторов Veinoplus,1105.0,4.8,752,Mиостимулятор
111895544,Комплект электродов подходят для PowerDot 2.0 на магнитах,1509.0,4.9,58,Mиостимулятор
63553819,"Миостимулятор 2.0 DUO, красный",29335.0,4.4,14,PowerDot
370378016,Массажер миостимулятор для тела электрический,522.0,0.0,0,
397642859,Миостимулятор для пресса,961.0,4.9,110,
205940652,Комплект электродов для миостимуляторов 7х14 см,677.0,4.8,752,Миостимулятор
177520662,Миостимулятор-массажер EM80,7142.0,5.0,4,Beurer
417364535,Электроды для миостимуляторов и импульсных массажеров,500.0,4.9,1021,
391708579,Импульсный миостимулятор для лечения всего тела,722.0,0.0,0,
410958663,Миостимулятор для мышечной коррекции,862.0,0.0,0,
231332321,Массажер для похудения живота миостимулятор для пресса пояс,880.0,4.1,1755,Plantos
397300881,Массажер перкуссионный электрический вибромассажер,2271.0,4.9,387,Massager gun
341030034,Миостимулятор массажер для физиотерапии электрический,839.0,0.0,0,RuMir
245525396,Миостимулятор для мышц тазового дна,4591.0,4.6,698,ROASTERS
320569490,Миостимулятор пояс для похудения,446.0,4.3,67,Sharif Shop
173241584,Косметический микротоковый вибромассажер для лица,1646.0,4.4,352,Dimarket
360783981,Миостимулятор массажер импульсный электрический для тела,2891.0,0.0,0,ElectricOnline
151447829,Электроды для миостимулятора,261.0,4.3,8854,nazare
205938409,"Комплект электродов для миостимуляторов 6,4х6,4 см",551.0,4.8,752,Миостимулятор
218560399,Массажер Тренажер электрический миостимулятор импульсный,560.0,4.0,2,Missis A
259347584,Тренажер-миостимулятор для тазового дна и пресса для женщин,3461.0,4.9,243,Excellent Style
160976990,Массажер миостимулятор цифровой,465.0,4.4,12,RINARO
331908449,Массажер миостимулятор для терапии,1172.0,0.0,0,
204511996,Миостимулятор массажер для всего тела,1651.0,4.8,325,
369001845,Миостимулятор массажер для лица и тела электрический,710.0,5.0,2,RuMir
263006628,массажер перкуссионный электрический,1318.0,4.8,9073,GRAND
192979999,Пояс миостимулятор для похудения XXL,869.0,3.8,31,IDAGOODS
265934685,Микротоковый массажер для лица RF лифтинг Фонофорез EMS LED,2901.0,4.7,2476,
103849034,Массажер миостимулятор для терапии,584.0,4.1,20,Lucky L
272657295,"Миостимулятор, массажер импульсный для всего тела",1167.0,4.7,27,PowerNest
286626694,"Массажер для шеи, спины и тела",1909.0,4.9,1311,ATLAS M
258613995,Массажер миостимулятор вакуумный антицеллюлитный для тела,3009.0,4.8,384,DolcePeach
214302641,Миостимулятор массажер,437.0,4.1,7,RHinaHome
204120111,Миостимулятор EM49,8519.0,0.0,0,Beurer
279668560,Миостимулятор для пресса электростимулятор для похудения,659.0,4.3,130,
280595212,Сменные пластины на миостимулятор массажер для тела,94.0,4.7,77,
217653354,Миостимулятор массажер импульсный электрический для тела,1148.0,4.7,764,The Basket
390795117,Массажер миостимулятор для тела электрический,444.0,0.0,0,24na7
296821028,Миостимулятор тазового дна,3925.0,4.9,37,Море Полезностей
396262152,Пояс для похудения миостимулятор для тела,1283.0,5.0,5,ПолиМи
199105280,Портативный миостимулятор мышц,646.0,0.0,0,
278820954,Массажер миостимулятор бабочка,560.0,4.7,753,Массажер электрический
228992928,Сменные пластины на миостимулятор бабочка,410.0,4.7,753,Массажер электрический
283219626,Тренажер миостимулятор для пресса,285.0,4.1,11,stock store
319973063,"Миостимулятор для пресса, пояс для похудения",561.0,4.1,76,Ashna
265583838,Миостимулятор импульсный массажер шеи ног тела с пультом,541.0,4.6,18,TOTAR
402366122,Миостимулятор для тонуса мышц тела,1562.0,0.0,0,Xiaomi
312044972,Массажный пояс миостимулятор для пресса XXL -XXXL,592.0,4.5,10,
238408711,Миостимулятор. Тренажер для пресса и рук,501.0,4.4,36,HasaniGROUP
372517404,Миостимулятор для пресса и рук,1875.0,0.0,0,
328787629,Миостимулятор массажер электрический многофункциональный,1060.0,0.0,0,
48462484,Электрод для миостимулятора ABS Trainer MIO,1904.0,4.7,698,Yamaguchi
194597844,Массажер миостимулятор,944.0,5.0,2,Gold peony
